docs/tutorial/kernel_tuning/3_LibraryLogic/rembrandt_Cijk_Ailk_Bljk_HB_GB.yaml
- {MinimumRequiredVersion: 4.40.0}
- rembrandt
- gfx1035
- [Device 1681]
    SolutionIndex: 0
    SolutionNameMin: Cijk_Ailk_Bljk_HB_GB_MT128x64x8_SN_GLVWA8_GLVWB4_SU0_SUM0_SUS0_TT8_8_WG16_8_1_WGM1
    SolutionIndex: 1
    SolutionNameMin: Cijk_Ailk_Bljk_HB_GB_MT128x64x8_SN_GLVWA8_GLVWB4_SU32_SUM3_SUS128_TT8_8_WG16_8_1_WGM1
    SolutionIndex: 2
    SolutionNameMin: Cijk_Ailk_Bljk_HB_GB_MT128x64x8_SN_GLVWA8_GLVWB4_SU0_SUM0_SUS0_TT8_8_WG16_8_1_WGM4
    SolutionIndex: 3
    SolutionNameMin: Cijk_Ailk_Bljk_HB_GB_MT128x64x8_SN_GLVWA8_GLVWB4_SU0_SUM0_SUS0_TT8_8_WG16_8_1_WGM8
    SolutionIndex: 4
    SolutionNameMin: Cijk_Ailk_Bljk_HB_GB_MT128x64x8_SN_GLVWA8_GLVWB4_SU32_SUM3_SUS128_TT8_8_WG16_8_1_WGM8
    SolutionIndex: 5
    SolutionNameMin: Cijk_Ailk_Bljk_HB_GB_MT128x128x8_SN_GLVWA8_GLVWB8_SU0_SUM0_SUS0_TT8_16_WG16_8_1_WGM1
    SolutionIndex: 6
    SolutionNameMin: Cijk_Ailk_Bljk_HB_GB_MT128x128x8_SN_GLVWA8_GLVWB8_SU32_SUM3_SUS128_TT8_16_WG16_8_1_WGM1
    SolutionIndex: 7
    SolutionNameMin: Cijk_Ailk_Bljk_HB_GB_MT128x128x8_SN_GLVWA8_GLVWB8_SU0_SUM0_SUS0_TT8_16_WG16_8_1_WGM4
    SolutionIndex: 8
    SolutionNameMin: Cijk_Ailk_Bljk_HB_GB_MT128x128x8_SN_GLVWA8_GLVWB8_SU32_SUM3_SUS128_TT8_16_WG16_8_1_WGM4
    SolutionIndex: 9
    SolutionNameMin: Cijk_Ailk_Bljk_HB_GB_MT128x128x8_SN_GLVWA8_GLVWB8_SU0_SUM0_SUS0_TT8_16_WG16_8_1_WGM8
    SolutionIndex: 10
    SolutionNameMin: Cijk_Ailk_Bljk_HB_GB_MT128x128x8_SN_GLVWA8_GLVWB8_SU32_SUM3_SUS128_TT8_16_WG16_8_1_WGM8
    SolutionIndex: 11
    SolutionNameMin: Cijk_Ailk_Bljk_HB_GB_MT256x128x8_SN_GLVWA8_GLVWB8_SU0_SUM0_SUS0_TT16_16_WG16_8_1_WGM1
    SolutionIndex: 12
    SolutionNameMin: Cijk_Ailk_Bljk_HB_GB_MT256x128x8_SN_GLVWA8_GLVWB8_SU32_SUM3_SUS128_TT16_16_WG16_8_1_WGM1
    SolutionIndex: 13
    SolutionNameMin: Cijk_Ailk_Bljk_HB_GB_MT256x256x8_SN_GLVWA8_GLVWB8_SU0_SUM0_SUS0_TT16_16_WG16_16_1_WGM1
    SolutionIndex: 14
    SolutionNameMin: Cijk_Ailk_Bljk_HB_GB_MT256x256x8_SN_GLVWA8_GLVWB8_SU32_SUM3_SUS128_TT16_16_WG16_16_1_WGM1
    SolutionIndex: 15
    SolutionNameMin: Cijk_Ailk_Bljk_HB_GB_MT256x128x8_SN_GLVWA8_GLVWB8_SU0_SUM0_SUS0_TT16_16_WG16_8_1_WGM4
    SolutionIndex: 16
    SolutionNameMin: Cijk_Ailk_Bljk_HB_GB_MT256x128x8_SN_GLVWA8_GLVWB8_SU32_SUM3_SUS128_TT16_16_WG16_8_1_WGM4
    SolutionIndex: 17
    SolutionNameMin: Cijk_Ailk_Bljk_HB_GB_MT256x256x8_SN_GLVWA8_GLVWB8_SU0_SUM0_SUS0_TT16_16_WG16_16_1_WGM4
    SolutionIndex: 18
    SolutionNameMin: Cijk_Ailk_Bljk_HB_GB_MT256x128x8_SN_GLVWA8_GLVWB8_SU0_SUM0_SUS0_TT16_16_WG16_8_1_WGM8
    SolutionIndex: 19
    SolutionNameMin: Cijk_Ailk_Bljk_HB_GB_MT256x128x8_SN_GLVWA8_GLVWB8_SU32_SUM3_SUS128_TT16_16_WG16_8_1_WGM8
    SolutionIndex: 20
    SolutionNameMin: Cijk_Ailk_Bljk_HB_GB_MT256x256x8_SN_GLVWA8_GLVWB8_SU0_SUM0_SUS0_TT16_16_WG16_16_1_WGM8
    SolutionIndex: 21
    SolutionNameMin: Cijk_Ailk_Bljk_HB_GB_MT128x64x16_SN_GLVWA8_GLVWB8_SU0_SUM0_SUS0_TT8_8_WG16_8_1_WGM1
    SolutionIndex: 22
    SolutionNameMin: Cijk_Ailk_Bljk_HB_GB_MT128x64x16_SN_GLVWA8_GLVWB8_SU32_SUM3_SUS128_TT8_8_WG16_8_1_WGM1
    SolutionIndex: 23
    SolutionNameMin: Cijk_Ailk_Bljk_HB_GB_MT128x128x16_SN_GLVWA8_GLVWB8_SU0_SUM0_SUS0_TT8_8_WG16_16_1_WGM1
    SolutionIndex: 24
    SolutionNameMin: Cijk_Ailk_Bljk_HB_GB_MT128x128x16_SN_GLVWA8_GLVWB8_SU32_SUM3_SUS128_TT8_8_WG16_16_1_WGM1
    SolutionIndex: 25
    SolutionNameMin: Cijk_Ailk_Bljk_HB_GB_MT128x64x16_SN_GLVWA8_GLVWB8_SU0_SUM0_SUS0_TT8_8_WG16_8_1_WGM4
    SolutionIndex: 26
    SolutionNameMin: Cijk_Ailk_Bljk_HB_GB_MT128x64x16_SN_GLVWA8_GLVWB8_SU32_SUM3_SUS128_TT8_8_WG16_8_1_WGM4
    SolutionIndex: 27
    SolutionNameMin: Cijk_Ailk_Bljk_HB_GB_MT128x128x16_SN_GLVWA8_GLVWB8_SU0_SUM0_SUS0_TT8_8_WG16_16_1_WGM4
    SolutionIndex: 28
    SolutionNameMin: Cijk_Ailk_Bljk_HB_GB_MT128x128x16_SN_GLVWA8_GLVWB8_SU32_SUM3_SUS128_TT8_8_WG16_16_1_WGM4
    SolutionIndex: 29
    SolutionNameMin: Cijk_Ailk_Bljk_HB_GB_MT128x64x16_SN_GLVWA8_GLVWB8_SU0_SUM0_SUS0_TT8_8_WG16_8_1_WGM8
    SolutionIndex: 30
    SolutionNameMin: Cijk_Ailk_Bljk_HB_GB_MT128x64x16_SN_GLVWA8_GLVWB8_SU32_SUM3_SUS128_TT8_8_WG16_8_1_WGM8
    SolutionIndex: 31
    SolutionNameMin: Cijk_Ailk_Bljk_HB_GB_MT128x128x16_SN_GLVWA8_GLVWB8_SU0_SUM0_SUS0_TT8_8_WG16_16_1_WGM8
    SolutionIndex: 32
    SolutionNameMin: Cijk_Ailk_Bljk_HB_GB_MT128x128x16_SN_GLVWA8_GLVWB8_SU32_SUM3_SUS128_TT8_8_WG16_16_1_WGM8
    SolutionIndex: 33
    SolutionNameMin: Cijk_Ailk_Bljk_HB_GB_MT128x128x16_SN_GLVWA8_GLVWB8_SU0_SUM0_SUS0_TT8_16_WG16_8_1_WGM1
    SolutionIndex: 34
    SolutionNameMin: Cijk_Ailk_Bljk_HB_GB_MT128x128x16_SN_GLVWA8_GLVWB8_SU32_SUM3_SUS128_TT8_16_WG16_8_1_WGM1
    SolutionIndex: 35
    SolutionNameMin: Cijk_Ailk_Bljk_HB_GB_MT128x256x16_SN_GLVWA8_GLVWB8_SU0_SUM0_SUS0_TT8_16_WG16_16_1_WGM1
    SolutionIndex: 36
    SolutionNameMin: Cijk_Ailk_Bljk_HB_GB_MT128x256x16_SN_GLVWA8_GLVWB8_SU32_SUM3_SUS128_TT8_16_WG16_16_1_WGM1
    SolutionIndex: 37
    SolutionNameMin: Cijk_Ailk_Bljk_HB_GB_MT128x128x16_SN_GLVWA8_GLVWB8_SU0_SUM0_SUS0_TT8_16_WG16_8_1_WGM4
    SolutionIndex: 38
    SolutionNameMin: Cijk_Ailk_Bljk_HB_GB_MT128x128x16_SN_GLVWA8_GLVWB8_SU32_SUM3_SUS128_TT8_16_WG16_8_1_WGM4
    SolutionIndex: 39
    SolutionNameMin: Cijk_Ailk_Bljk_HB_GB_MT128x256x16_SN_GLVWA8_GLVWB8_SU0_SUM0_SUS0_TT8_16_WG16_16_1_WGM4
    SolutionIndex: 40
    SolutionNameMin: Cijk_Ailk_Bljk_HB_GB_MT128x256x16_SN_GLVWA8_GLVWB8_SU32_SUM3_SUS128_TT8_16_WG16_16_1_WGM4
    SolutionIndex: 41
    SolutionNameMin: Cijk_Ailk_Bljk_HB_GB_MT128x128x16_SN_GLVWA8_GLVWB8_SU0_SUM0_SUS0_TT8_16_WG16_8_1_WGM8
    SolutionIndex: 42
    SolutionNameMin: Cijk_Ailk_Bljk_HB_GB_MT128x128x16_SN_GLVWA8_GLVWB8_SU32_SUM3_SUS128_TT8_16_WG16_8_1_WGM8
    SolutionIndex: 43
    SolutionNameMin: Cijk_Ailk_Bljk_HB_GB_MT128x256x16_SN_GLVWA8_GLVWB8_SU0_SUM0_SUS0_TT8_16_WG16_16_1_WGM8
    SolutionIndex: 44
    SolutionNameMin: Cijk_Ailk_Bljk_HB_GB_MT128x256x16_SN_GLVWA8_GLVWB8_SU32_SUM3_SUS128_TT8_16_WG16_16_1_WGM8
    SolutionIndex: 45
    SolutionNameMin: Cijk_Ailk_Bljk_HB_GB_MT256x128x16_SN_GLVWA8_GLVWB8_SU0_SUM0_SUS0_TT16_16_WG16_8_1_WGM1
    SolutionIndex: 46
    SolutionNameMin: Cijk_Ailk_Bljk_HB_GB_MT256x128x16_SN_GLVWA8_GLVWB8_SU32_SUM3_SUS128_TT16_16_WG16_8_1_WGM1
    SolutionIndex: 47
    SolutionNameMin: Cijk_Ailk_Bljk_HB_GB_MT256x256x16_SN_GLVWA8_GLVWB8_SU0_SUM0_SUS0_TT16_16_WG16_16_1_WGM1
    SolutionIndex: 48
    SolutionNameMin: Cijk_Ailk_Bljk_HB_GB_MT256x256x16_SN_GLVWA8_GLVWB8_SU32_SUM3_SUS128_TT16_16_WG16_16_1_WGM1
    SolutionIndex: 49
    SolutionNameMin: Cijk_Ailk_Bljk_HB_GB_MT256x128x16_SN_GLVWA8_GLVWB8_SU0_SUM0_SUS0_TT16_16_WG16_8_1_WGM4
    SolutionIndex: 50
    SolutionNameMin: Cijk_Ailk_Bljk_HB_GB_MT256x128x16_SN_GLVWA8_GLVWB8_SU32_SUM3_SUS128_TT16_16_WG16_8_1_WGM4
    SolutionIndex: 51
    SolutionNameMin: Cijk_Ailk_Bljk_HB_GB_MT256x256x16_SN_GLVWA8_GLVWB8_SU0_SUM0_SUS0_TT16_16_WG16_16_1_WGM4
    SolutionIndex: 52
    SolutionNameMin: Cijk_Ailk_Bljk_HB_GB_MT256x256x16_SN_GLVWA8_GLVWB8_SU32_SUM3_SUS128_TT16_16_WG16_16_1_WGM4
    SolutionIndex: 53
    SolutionNameMin: Cijk_Ailk_Bljk_HB_GB_MT256x128x16_SN_GLVWA8_GLVWB8_SU0_SUM0_SUS0_TT16_16_WG16_8_1_WGM8
    SolutionIndex: 54
    SolutionNameMin: Cijk_Ailk_Bljk_HB_GB_MT256x128x16_SN_GLVWA8_GLVWB8_SU32_SUM3_SUS128_TT16_16_WG16_8_1_WGM8
    SolutionIndex: 55
    SolutionNameMin: Cijk_Ailk_Bljk_HB_GB_MT256x256x16_SN_GLVWA8_GLVWB8_SU0_SUM0_SUS0_TT16_16_WG16_16_1_WGM8
    SolutionIndex: 56
    SolutionNameMin: Cijk_Ailk_Bljk_HB_GB_MT256x256x16_SN_GLVWA8_GLVWB8_SU32_SUM3_SUS128_TT16_16_WG16_16_1_WGM8
    SolutionIndex: 57
    SolutionNameMin: Cijk_Ailk_Bljk_HB_GB_MT128x64x32_SN_GLVWA8_GLVWB8_SU0_SUM0_SUS0_TT8_8_WG16_8_1_WGM1
    SolutionIndex: 58
    SolutionNameMin: Cijk_Ailk_Bljk_HB_GB_MT128x64x32_SN_GLVWA8_GLVWB8_SU32_SUM3_SUS128_TT8_8_WG16_8_1_WGM1
    SolutionIndex: 59
    SolutionNameMin: Cijk_Ailk_Bljk_HB_GB_MT128x128x32_SN_GLVWA8_GLVWB8_SU0_SUM0_SUS0_TT8_8_WG16_16_1_WGM1
    SolutionIndex: 60
    SolutionNameMin: Cijk_Ailk_Bljk_HB_GB_MT128x128x32_SN_GLVWA8_GLVWB8_SU32_SUM3_SUS128_TT8_8_WG16_16_1_WGM1
    SolutionIndex: 61
    SolutionNameMin: Cijk_Ailk_Bljk_HB_GB_MT128x64x32_SN_GLVWA8_GLVWB8_SU0_SUM0_SUS0_TT8_8_WG16_8_1_WGM4
    SolutionIndex: 62
    SolutionNameMin: Cijk_Ailk_Bljk_HB_GB_MT128x64x32_SN_GLVWA8_GLVWB8_SU32_SUM3_SUS128_TT8_8_WG16_8_1_WGM4
    SolutionIndex: 63
    SolutionNameMin: Cijk_Ailk_Bljk_HB_GB_MT128x128x32_SN_GLVWA8_GLVWB8_SU0_SUM0_SUS0_TT8_8_WG16_16_1_WGM4
    SolutionIndex: 64
    SolutionNameMin: Cijk_Ailk_Bljk_HB_GB_MT128x64x32_SN_GLVWA8_GLVWB8_SU0_SUM0_SUS0_TT8_8_WG16_8_1_WGM8
    SolutionIndex: 65
    SolutionNameMin: Cijk_Ailk_Bljk_HB_GB_MT128x64x32_SN_GLVWA8_GLVWB8_SU32_SUM3_SUS128_TT8_8_WG16_8_1_WGM8
    SolutionIndex: 66
    SolutionNameMin: Cijk_Ailk_Bljk_HB_GB_MT128x128x32_SN_GLVWA8_GLVWB8_SU0_SUM0_SUS0_TT8_8_WG16_16_1_WGM8
    SolutionIndex: 67
    SolutionNameMin: Cijk_Ailk_Bljk_HB_GB_MT128x128x32_SN_GLVWA8_GLVWB8_SU32_SUM3_SUS128_TT8_8_WG16_16_1_WGM8
    SolutionIndex: 68
    SolutionNameMin: Cijk_Ailk_Bljk_HB_GB_MT128x256x32_SN_GLVWA8_GLVWB8_SU0_SUM0_SUS0_TT8_16_WG16_16_1_WGM1
    SolutionIndex: 69
    SolutionNameMin: Cijk_Ailk_Bljk_HB_GB_MT128x256x32_SN_GLVWA8_GLVWB8_SU32_SUM3_SUS128_TT8_16_WG16_16_1_WGM1
    SolutionIndex: 70
    SolutionNameMin: Cijk_Ailk_Bljk_HB_GB_MT128x128x32_SN_GLVWA8_GLVWB8_SU0_SUM0_SUS0_TT8_16_WG16_8_1_WGM4
    SolutionIndex: 71
    SolutionNameMin: Cijk_Ailk_Bljk_HB_GB_MT128x256x32_SN_GLVWA8_GLVWB8_SU0_SUM0_SUS0_TT8_16_WG16_16_1_WGM4
    SolutionIndex: 72
    SolutionNameMin: Cijk_Ailk_Bljk_HB_GB_MT128x256x32_SN_GLVWA8_GLVWB8_SU32_SUM3_SUS128_TT8_16_WG16_16_1_WGM4
    SolutionIndex: 73
    SolutionNameMin: Cijk_Ailk_Bljk_HB_GB_MT128x128x32_SN_GLVWA8_GLVWB8_SU0_SUM0_SUS0_TT8_16_WG16_8_1_WGM8
    SolutionIndex: 74
    SolutionNameMin: Cijk_Ailk_Bljk_HB_GB_MT128x128x32_SN_GLVWA8_GLVWB8_SU32_SUM3_SUS128_TT8_16_WG16_8_1_WGM8
    SolutionIndex: 75
    SolutionNameMin: Cijk_Ailk_Bljk_HB_GB_MT128x256x32_SN_GLVWA8_GLVWB8_SU0_SUM0_SUS0_TT8_16_WG16_16_1_WGM8
    SolutionIndex: 76
    SolutionNameMin: Cijk_Ailk_Bljk_HB_GB_MT256x128x32_SN_GLVWA8_GLVWB8_SU0_SUM0_SUS0_TT16_16_WG16_8_1_WGM1
    SolutionIndex: 77
    SolutionNameMin: Cijk_Ailk_Bljk_HB_GB_MT256x256x32_SN_GLVWA8_GLVWB8_SU0_SUM0_SUS0_TT16_16_WG16_16_1_WGM1
    SolutionIndex: 78
    SolutionNameMin: Cijk_Ailk_Bljk_HB_GB_MT256x256x32_SN_GLVWA8_GLVWB8_SU32_SUM3_SUS128_TT16_16_WG16_16_1_WGM1
    SolutionIndex: 79
    SolutionNameMin: Cijk_Ailk_Bljk_HB_GB_MT256x128x32_SN_GLVWA8_GLVWB8_SU0_SUM0_SUS0_TT16_16_WG16_8_1_WGM4
    SolutionIndex: 80
    SolutionNameMin: Cijk_Ailk_Bljk_HB_GB_MT256x128x32_SN_GLVWA8_GLVWB8_SU32_SUM3_SUS128_TT16_16_WG16_8_1_WGM4
    SolutionIndex: 81
    SolutionNameMin: Cijk_Ailk_Bljk_HB_GB_MT256x256x32_SN_GLVWA8_GLVWB8_SU0_SUM0_SUS0_TT16_16_WG16_16_1_WGM4
    SolutionIndex: 82
    SolutionNameMin: Cijk_Ailk_Bljk_HB_GB_MT256x256x32_SN_GLVWA8_GLVWB8_SU32_SUM3_SUS128_TT16_16_WG16_16_1_WGM4
    SolutionIndex: 83
    SolutionNameMin: Cijk_Ailk_Bljk_HB_GB_MT256x256x32_SN_GLVWA8_GLVWB8_SU32_SUM3_SUS128_TT16_16_WG16_16_1_WGM8
    SolutionIndex: 84
    SolutionNameMin: Cijk_Ailk_Bljk_HB_GB_MT64x64x8_SN_GLVWA8_GLVWB8_SU0_SUM0_SUS0_TT8_8_WG8_8_1_WGM1
    SolutionIndex: 85
    SolutionNameMin: Cijk_Ailk_Bljk_HB_GB_MT128x64x8_SN_GLVWA8_GLVWB4_SU0_SUM0_SUS0_TT8_8_WG16_8_1_WGM1
    SolutionIndex: 86
    SolutionNameMin: Cijk_Ailk_Bljk_HB_GB_MT128x64x8_SN_GLVWA8_GLVWB4_SU32_SUM3_SUS128_TT8_8_WG16_8_1_WGM1
    SolutionIndex: 87
    SolutionNameMin: Cijk_Ailk_Bljk_HB_GB_MT128x64x8_SN_GLVWA8_GLVWB4_SU0_SUM0_SUS0_TT8_8_WG16_8_1_WGM4
    SolutionIndex: 88
    SolutionNameMin: Cijk_Ailk_Bljk_HB_GB_MT128x64x8_SN_GLVWA8_GLVWB4_SU32_SUM3_SUS128_TT8_8_WG16_8_1_WGM4
    SolutionIndex: 89
    SolutionNameMin: Cijk_Ailk_Bljk_HB_GB_MT128x64x8_SN_GLVWA8_GLVWB4_SU0_SUM0_SUS0_TT8_8_WG16_8_1_WGM8
    SolutionIndex: 90
    SolutionNameMin: Cijk_Ailk_Bljk_HB_GB_MT128x64x8_SN_GLVWA8_GLVWB4_SU32_SUM3_SUS128_TT8_8_WG16_8_1_WGM8
    SolutionIndex: 91
    SolutionNameMin: Cijk_Ailk_Bljk_HB_GB_MT64x64x16_SN_GLVWA8_GLVWB8_SU0_SUM0_SUS0_TT8_8_WG8_8_1_WGM1
    SolutionIndex: 92
    SolutionNameMin: Cijk_Ailk_Bljk_HB_GB_MT64x64x16_SN_GLVWA8_GLVWB8_SU32_SUM3_SUS128_TT8_8_WG8_8_1_WGM1
    SolutionIndex: 93
    SolutionNameMin: Cijk_Ailk_Bljk_HB_GB_MT128x64x16_SN_GLVWA8_GLVWB8_SU0_SUM0_SUS0_TT8_8_WG16_8_1_WGM1
    SolutionIndex: 94
    SolutionNameMin: Cijk_Ailk_Bljk_HB_GB_MT128x64x16_SN_GLVWA8_GLVWB8_SU32_SUM3_SUS128_TT8_8_WG16_8_1_WGM1
    SolutionIndex: 95
    SolutionNameMin: Cijk_Ailk_Bljk_HB_GB_MT128x128x16_SN_GLVWA8_GLVWB8_SU0_SUM0_SUS0_TT8_8_WG16_16_1_WGM1
    SolutionIndex: 96
    SolutionNameMin: Cijk_Ailk_Bljk_HB_GB_MT128x128x16_SN_GLVWA8_GLVWB8_SU32_SUM3_SUS128_TT8_8_WG16_16_1_WGM1
    SolutionIndex: 97
    SolutionNameMin: Cijk_Ailk_Bljk_HB_GB_MT64x64x16_SN_GLVWA8_GLVWB8_SU0_SUM0_SUS0_TT8_8_WG8_8_1_WGM4
    SolutionIndex: 98
    SolutionNameMin: Cijk_Ailk_Bljk_HB_GB_MT64x64x16_SN_GLVWA8_GLVWB8_SU32_SUM3_SUS128_TT8_8_WG8_8_1_WGM4
    SolutionIndex: 99
    SolutionNameMin: Cijk_Ailk_Bljk_HB_GB_MT128x64x16_SN_GLVWA8_GLVWB8_SU0_SUM0_SUS0_TT8_8_WG16_8_1_WGM4
    SolutionIndex: 100
    SolutionNameMin: Cijk_Ailk_Bljk_HB_GB_MT128x64x16_SN_GLVWA8_GLVWB8_SU32_SUM3_SUS128_TT8_8_WG16_8_1_WGM4
    SolutionIndex: 101
    SolutionNameMin: Cijk_Ailk_Bljk_HB_GB_MT128x128x16_SN_GLVWA8_GLVWB8_SU0_SUM0_SUS0_TT8_8_WG16_16_1_WGM4
    SolutionIndex: 102
    SolutionNameMin: Cijk_Ailk_Bljk_HB_GB_MT128x128x16_SN_GLVWA8_GLVWB8_SU32_SUM3_SUS128_TT8_8_WG16_16_1_WGM4
    SolutionIndex: 103
    SolutionNameMin: Cijk_Ailk_Bljk_HB_GB_MT64x64x16_SN_GLVWA8_GLVWB8_SU32_SUM3_SUS128_TT8_8_WG8_8_1_WGM8
    SolutionIndex: 104
    SolutionNameMin: Cijk_Ailk_Bljk_HB_GB_MT128x64x16_SN_GLVWA8_GLVWB8_SU0_SUM0_SUS0_TT8_8_WG16_8_1_WGM8
    SolutionIndex: 105
    SolutionNameMin: Cijk_Ailk_Bljk_HB_GB_MT128x64x16_SN_GLVWA8_GLVWB8_SU32_SUM3_SUS128_TT8_8_WG16_8_1_WGM8
    SolutionIndex: 106
    SolutionNameMin: Cijk_Ailk_Bljk_HB_GB_MT128x128x16_SN_GLVWA8_GLVWB8_SU0_SUM0_SUS0_TT8_8_WG16_16_1_WGM8
    SolutionIndex: 107
    SolutionNameMin: Cijk_Ailk_Bljk_HB_GB_MT128x128x16_SN_GLVWA8_GLVWB8_SU32_SUM3_SUS128_TT8_8_WG16_16_1_WGM8
    SolutionIndex: 108
    SolutionNameMin: Cijk_Ailk_Bljk_HB_GB_MT64x64x32_SN_GLVWA8_GLVWB8_SU0_SUM0_SUS0_TT8_8_WG8_8_1_WGM1
    SolutionIndex: 109
    SolutionNameMin: Cijk_Ailk_Bljk_HB_GB_MT128x64x32_SN_GLVWA8_GLVWB8_SU0_SUM0_SUS0_TT8_8_WG16_8_1_WGM1
    SolutionIndex: 110
    SolutionNameMin: Cijk_Ailk_Bljk_HB_GB_MT128x64x32_SN_GLVWA8_GLVWB8_SU32_SUM3_SUS128_TT8_8_WG16_8_1_WGM1
    SolutionIndex: 111
    SolutionNameMin: Cijk_Ailk_Bljk_HB_GB_MT128x128x32_SN_GLVWA8_GLVWB8_SU32_SUM3_SUS128_TT8_8_WG16_16_1_WGM1
    SolutionIndex: 112
    SolutionNameMin: Cijk_Ailk_Bljk_HB_GB_MT64x64x32_SN_GLVWA8_GLVWB8_SU32_SUM3_SUS128_TT8_8_WG8_8_1_WGM4
    SolutionIndex: 113
    SolutionNameMin: Cijk_Ailk_Bljk_HB_GB_MT128x128x32_SN_GLVWA8_GLVWB8_SU32_SUM3_SUS128_TT8_8_WG16_16_1_WGM4
    SolutionIndex: 114
    SolutionNameMin: Cijk_Ailk_Bljk_HB_GB_MT128x64x32_SN_GLVWA8_GLVWB8_SU0_SUM0_SUS0_TT8_8_WG16_8_1_WGM8
    SolutionIndex: 115
    SolutionNameMin: Cijk_Ailk_Bljk_HB_GB_MT128x64x32_SN_GLVWA8_GLVWB8_SU32_SUM3_SUS128_TT8_8_WG16_8_1_WGM8
    SolutionIndex: 116
    SolutionNameMin: Cijk_Ailk_Bljk_HB_GB_MT128x128x32_SN_GLVWA8_GLVWB8_SU0_SUM0_SUS0_TT8_8_WG16_16_1_WGM8
    SolutionIndex: 117
    SolutionNameMin: Cijk_Ailk_Bljk_HB_GB_MT128x128x32_SN_GLVWA8_GLVWB8_SU32_SUM3_SUS128_TT8_8_WG16_16_1_WGM8
    SolutionIndex: 118
    SolutionNameMin: Cijk_Ailk_Bljk_HB_GB_MT16x16x8_SN_GLVWA2_GLVWB2_SU0_SUM0_SUS0_TT2_2_WG8_8_1_WGM1
    SolutionIndex: 119
    SolutionNameMin: Cijk_Ailk_Bljk_HB_GB_MT32x16x8_SN_GLVWA2_GLVWB1_SU32_SUM3_SUS128_TT2_2_WG16_8_1_WGM1
    SolutionIndex: 120
    SolutionNameMin: Cijk_Ailk_Bljk_HB_GB_MT32x32x8_SN_GLVWA1_GLVWB1_SU32_SUM3_SUS128_TT2_2_WG16_16_1_WGM1
    SolutionIndex: 121
    SolutionNameMin: Cijk_Ailk_Bljk_HB_GB_MT16x16x8_SN_GLVWA2_GLVWB2_SU32_SUM3_SUS128_TT2_2_WG8_8_1_WGM4
    SolutionIndex: 122
    SolutionNameMin: Cijk_Ailk_Bljk_HB_GB_MT32x32x8_SN_GLVWA1_GLVWB1_SU32_SUM3_SUS128_TT2_2_WG16_16_1_WGM4
    SolutionIndex: 123
    SolutionNameMin: Cijk_Ailk_Bljk_HB_GB_MT64x32x8_SN_GLVWA2_GLVWB2_SU0_SUM0_SUS0_TT4_4_WG16_8_1_WGM1
    SolutionIndex: 124
    SolutionNameMin: Cijk_Ailk_Bljk_HB_GB_MT64x32x8_SN_GLVWA2_GLVWB2_SU32_SUM3_SUS128_TT4_4_WG16_8_1_WGM1
    SolutionIndex: 125
    SolutionNameMin: Cijk_Ailk_Bljk_HB_GB_MT64x64x8_SN_GLVWA2_GLVWB2_SU0_SUM0_SUS0_TT4_4_WG16_16_1_WGM1
    SolutionIndex: 126
    SolutionNameMin: Cijk_Ailk_Bljk_HB_GB_MT32x32x8_SN_GLVWA2_GLVWB2_SU0_SUM0_SUS0_TT4_4_WG8_8_1_WGM8
    SolutionIndex: 127
    SolutionNameMin: Cijk_Ailk_Bljk_HB_GB_MT16x16x16_SN_GLVWA2_GLVWB2_SU0_SUM0_SUS0_TT2_2_WG8_8_1_WGM1
    SolutionIndex: 128
    SolutionNameMin: Cijk_Ailk_Bljk_HB_GB_MT32x16x16_SN_GLVWA2_GLVWB2_SU0_SUM0_SUS0_TT2_2_WG16_8_1_WGM1
    SolutionIndex: 129
    SolutionNameMin: Cijk_Ailk_Bljk_HB_GB_MT32x16x16_SN_GLVWA2_GLVWB2_SU32_SUM3_SUS128_TT2_2_WG16_8_1_WGM1
    SolutionIndex: 130
    SolutionNameMin: Cijk_Ailk_Bljk_HB_GB_MT32x32x16_SN_GLVWA2_GLVWB2_SU32_SUM3_SUS128_TT2_2_WG16_16_1_WGM1
    SolutionIndex: 131
    SolutionNameMin: Cijk_Ailk_Bljk_HB_GB_MT32x16x16_SN_GLVWA2_GLVWB2_SU32_SUM3_SUS128_TT2_2_WG16_8_1_WGM4
    SolutionIndex: 132
    SolutionNameMin: Cijk_Ailk_Bljk_HB_GB_MT32x16x16_SN_GLVWA2_GLVWB2_SU0_SUM0_SUS0_TT2_2_WG16_8_1_WGM8
    SolutionIndex: 133
    SolutionNameMin: Cijk_Ailk_Bljk_HB_GB_MT32x32x16_SN_GLVWA2_GLVWB2_SU0_SUM0_SUS0_TT2_2_WG16_16_1_WGM8
    SolutionIndex: 134
    SolutionNameMin: Cijk_Ailk_Bljk_HB_GB_MT32x32x16_SN_GLVWA2_GLVWB2_SU32_SUM3_SUS128_TT2_2_WG16_16_1_WGM8
    SolutionIndex: 135
    SolutionNameMin: Cijk_Ailk_Bljk_HB_GB_MT64x32x16_SN_GLVWA2_GLVWB2_SU0_SUM0_SUS0_TT4_4_WG16_8_1_WGM1
    SolutionIndex: 136
    SolutionNameMin: Cijk_Ailk_Bljk_HB_GB_MT64x32x16_SN_GLVWA2_GLVWB2_SU32_SUM3_SUS128_TT4_4_WG16_8_1_WGM1
    SolutionIndex: 137
    SolutionNameMin: Cijk_Ailk_Bljk_HB_GB_MT64x64x16_SN_GLVWA2_GLVWB2_SU0_SUM0_SUS0_TT4_4_WG16_16_1_WGM1
    SolutionIndex: 138
    SolutionNameMin: Cijk_Ailk_Bljk_HB_GB_MT64x64x16_SN_GLVWA2_GLVWB2_SU32_SUM3_SUS128_TT4_4_WG16_16_1_WGM1
    SolutionIndex: 139
    SolutionNameMin: Cijk_Ailk_Bljk_HB_GB_MT32x32x16_SN_GLVWA2_GLVWB2_SU32_SUM3_SUS128_TT4_4_WG8_8_1_WGM4
    SolutionIndex: 140
    SolutionNameMin: Cijk_Ailk_Bljk_HB_GB_MT64x32x16_SN_GLVWA2_GLVWB2_SU0_SUM0_SUS0_TT4_4_WG16_8_1_WGM4
    SolutionIndex: 141
    SolutionNameMin: Cijk_Ailk_Bljk_HB_GB_MT64x32x16_SN_GLVWA2_GLVWB2_SU32_SUM3_SUS128_TT4_4_WG16_8_1_WGM4
    SolutionIndex: 142
    SolutionNameMin: Cijk_Ailk_Bljk_HB_GB_MT64x64x16_SN_GLVWA2_GLVWB2_SU0_SUM0_SUS0_TT4_4_WG16_16_1_WGM4
    SolutionIndex: 143
    SolutionNameMin: Cijk_Ailk_Bljk_HB_GB_MT64x64x16_SN_GLVWA2_GLVWB2_SU32_SUM3_SUS128_TT4_4_WG16_16_1_WGM4
    SolutionIndex: 144
    SolutionNameMin: Cijk_Ailk_Bljk_HB_GB_MT32x32x16_SN_GLVWA2_GLVWB2_SU0_SUM0_SUS0_TT4_4_WG8_8_1_WGM8
    SolutionIndex: 145
    SolutionNameMin: Cijk_Ailk_Bljk_HB_GB_MT64x32x16_SN_GLVWA2_GLVWB2_SU0_SUM0_SUS0_TT4_4_WG16_8_1_WGM8
    SolutionIndex: 146
    SolutionNameMin: Cijk_Ailk_Bljk_HB_GB_MT64x32x16_SN_GLVWA2_GLVWB2_SU32_SUM3_SUS128_TT4_4_WG16_8_1_WGM8
    SolutionIndex: 147
    SolutionNameMin: Cijk_Ailk_Bljk_HB_GB_MT64x64x16_SN_GLVWA2_GLVWB2_SU0_SUM0_SUS0_TT4_4_WG16_16_1_WGM8
    SolutionIndex: 148
    SolutionNameMin: Cijk_Ailk_Bljk_HB_GB_MT64x64x16_SN_GLVWA2_GLVWB2_SU32_SUM3_SUS128_TT4_4_WG16_16_1_WGM8
    SolutionIndex: 149
    SolutionNameMin: Cijk_Ailk_Bljk_HB_GB_MT16x16x32_SN_GLVWA2_GLVWB2_SU0_SUM0_SUS0_TT2_2_WG8_8_1_WGM1
    SolutionIndex: 150
    SolutionNameMin: Cijk_Ailk_Bljk_HB_GB_MT32x16x32_SN_GLVWA2_GLVWB2_SU0_SUM0_SUS0_TT2_2_WG16_8_1_WGM1
    SolutionIndex: 151
    SolutionNameMin: Cijk_Ailk_Bljk_HB_GB_MT32x16x32_SN_GLVWA2_GLVWB2_SU32_SUM3_SUS128_TT2_2_WG16_8_1_WGM1
    SolutionIndex: 152
    SolutionNameMin: Cijk_Ailk_Bljk_HB_GB_MT32x32x32_SN_GLVWA2_GLVWB2_SU0_SUM0_SUS0_TT2_2_WG16_16_1_WGM1
    SolutionIndex: 153
    SolutionNameMin: Cijk_Ailk_Bljk_HB_GB_MT32x16x32_SN_GLVWA2_GLVWB2_SU0_SUM0_SUS0_TT2_2_WG16_8_1_WGM4
    SolutionIndex: 154
    SolutionNameMin: Cijk_Ailk_Bljk_HB_GB_MT32x16x32_SN_GLVWA2_GLVWB2_SU32_SUM3_SUS128_TT2_2_WG16_8_1_WGM4
    SolutionIndex: 155
    SolutionNameMin: Cijk_Ailk_Bljk_HB_GB_MT32x32x32_SN_GLVWA2_GLVWB2_SU0_SUM0_SUS0_TT2_2_WG16_16_1_WGM4
    SolutionIndex: 156
    SolutionNameMin: Cijk_Ailk_Bljk_HB_GB_MT32x16x32_SN_GLVWA2_GLVWB2_SU0_SUM0_SUS0_TT2_2_WG16_8_1_WGM8
    SolutionIndex: 157
    SolutionNameMin: Cijk_Ailk_Bljk_HB_GB_MT32x32x32_SN_GLVWA2_GLVWB2_SU32_SUM3_SUS128_TT2_2_WG16_16_1_WGM8
    SolutionIndex: 158
    SolutionNameMin: Cijk_Ailk_Bljk_HB_GB_MT64x32x32_SN_GLVWA2_GLVWB2_SU0_SUM0_SUS0_TT4_4_WG16_8_1_WGM1
    SolutionIndex: 159
    SolutionNameMin: Cijk_Ailk_Bljk_HB_GB_MT64x64x32_SN_GLVWA2_GLVWB2_SU0_SUM0_SUS0_TT4_4_WG16_16_1_WGM1
    SolutionIndex: 160
    SolutionNameMin: Cijk_Ailk_Bljk_HB_GB_MT64x64x32_SN_GLVWA2_GLVWB2_SU32_SUM3_SUS128_TT4_4_WG16_16_1_WGM1
    SolutionIndex: 161
    SolutionNameMin: Cijk_Ailk_Bljk_HB_GB_MT32x32x32_SN_GLVWA2_GLVWB2_SU0_SUM0_SUS0_TT4_4_WG8_8_1_WGM4
    SolutionIndex: 162
    SolutionNameMin: Cijk_Ailk_Bljk_HB_GB_MT64x32x32_SN_GLVWA2_GLVWB2_SU0_SUM0_SUS0_TT4_4_WG16_8_1_WGM4
    SolutionIndex: 163
    SolutionNameMin: Cijk_Ailk_Bljk_HB_GB_MT64x32x32_SN_GLVWA2_GLVWB2_SU32_SUM3_SUS128_TT4_4_WG16_8_1_WGM4
    SolutionIndex: 164
    SolutionNameMin: Cijk_Ailk_Bljk_HB_GB_MT64x64x32_SN_GLVWA2_GLVWB2_SU0_SUM0_SUS0_TT4_4_WG16_16_1_WGM4
    SolutionIndex: 165
    SolutionNameMin: Cijk_Ailk_Bljk_HB_GB_MT64x64x32_SN_GLVWA2_GLVWB2_SU32_SUM3_SUS128_TT4_4_WG16_16_1_WGM4
    SolutionIndex: 166
    SolutionNameMin: Cijk_Ailk_Bljk_HB_GB_MT32x32x32_SN_GLVWA2_GLVWB2_SU32_SUM3_SUS128_TT4_4_WG8_8_1_WGM8
    SolutionIndex: 167
    SolutionNameMin: Cijk_Ailk_Bljk_HB_GB_MT64x32x32_SN_GLVWA2_GLVWB2_SU0_SUM0_SUS0_TT4_4_WG16_8_1_WGM8
    SolutionIndex: 168
    SolutionNameMin: Cijk_Ailk_Bljk_HB_GB_MT64x32x32_SN_GLVWA2_GLVWB2_SU32_SUM3_SUS128_TT4_4_WG16_8_1_WGM8
    SolutionIndex: 169
    SolutionNameMin: Cijk_Ailk_Bljk_HB_GB_MT64x64x32_SN_GLVWA2_GLVWB2_SU0_SUM0_SUS0_TT4_4_WG16_16_1_WGM8
    SolutionIndex: 170
    SolutionNameMin: Cijk_Ailk_Bljk_HB_GB_MT32x8x8_SN_GLVWA2_GLVWB1_SU0_SUM0_SUS0_TT2_2_WG16_4_1_WGM1
    SolutionIndex: 171
    SolutionNameMin: Cijk_Ailk_Bljk_HB_GB_MT64x16x8_SN_GLVWA2_GLVWB1_SU0_SUM0_SUS0_TT4_2_WG16_8_1_WGM1
    SolutionIndex: 172
    SolutionNameMin: Cijk_Ailk_Bljk_HB_GB_MT64x8x8_SN_GLVWA2_GLVWB1_SU0_SUM0_SUS0_TT4_2_WG16_4_1_WGM4
    SolutionIndex: 173
    SolutionNameMin: Cijk_Ailk_Bljk_HB_GB_MT64x16x8_SN_GLVWA2_GLVWB1_SU0_SUM0_SUS0_TT4_2_WG16_8_1_WGM4
    SolutionIndex: 174
    SolutionNameMin: Cijk_Ailk_Bljk_HB_GB_MT64x8x8_SN_GLVWA2_GLVWB1_SU0_SUM0_SUS0_TT4_2_WG16_4_1_WGM8
    SolutionIndex: 175
    SolutionNameMin: Cijk_Ailk_Bljk_HB_GB_MT64x8x16_SN_GLVWA2_GLVWB1_SU0_SUM0_SUS0_TT2_2_WG32_4_1_WGM1
    SolutionIndex: 176
    SolutionNameMin: Cijk_Ailk_Bljk_HB_GB_MT64x8x16_SN_GLVWA2_GLVWB1_SU0_SUM0_SUS0_TT2_2_WG32_4_1_WGM4
    SolutionIndex: 177
    SolutionNameMin: Cijk_Ailk_Bljk_HB_GB_MT64x8x16_SN_GLVWA2_GLVWB1_SU32_SUM3_SUS128_TT2_2_WG32_4_1_WGM4
    SolutionIndex: 178
    SolutionNameMin: Cijk_Ailk_Bljk_HB_GB_MT32x8x16_SN_GLVWA2_GLVWB2_SU0_SUM0_SUS0_TT2_2_WG16_4_1_WGM8
    SolutionIndex: 179
    SolutionNameMin: Cijk_Ailk_Bljk_HB_GB_MT64x8x16_SN_GLVWA2_GLVWB1_SU0_SUM0_SUS0_TT2_2_WG32_4_1_WGM8
    SolutionIndex: 180
    SolutionNameMin: Cijk_Ailk_Bljk_HB_GB_MT64x16x16_SN_GLVWA2_GLVWB2_SU32_SUM3_SUS128_TT4_2_WG16_8_1_WGM1
    SolutionIndex: 181
    SolutionNameMin: Cijk_Ailk_Bljk_HB_GB_MT64x8x16_SN_GLVWA2_GLVWB2_SU32_SUM3_SUS128_TT4_2_WG16_4_1_WGM4
    SolutionIndex: 182
    SolutionNameMin: Cijk_Ailk_Bljk_HB_GB_MT128x8x16_SN_GLVWA2_GLVWB1_SU32_SUM3_SUS128_TT4_2_WG32_4_1_WGM4
    SolutionIndex: 183
    SolutionNameMin: Cijk_Ailk_Bljk_HB_GB_MT128x8x16_SN_GLVWA2_GLVWB1_SU0_SUM0_SUS0_TT4_2_WG32_4_1_WGM8
    SolutionIndex: 184
    SolutionNameMin: Cijk_Ailk_Bljk_HB_GB_MT64x16x32_SN_GLVWA2_GLVWB2_SU0_SUM0_SUS0_TT4_2_WG16_8_1_WGM1
    SolutionIndex: 185
    SolutionNameMin: Cijk_Ailk_Bljk_HB_GB_MT64x16x32_SN_GLVWA2_GLVWB2_SU32_SUM3_SUS128_TT4_2_WG16_8_1_WGM8
- - - [2944, 4288, 1, 1280, 2944, 2944, 2944, 1280]
    - [47, 3540.57]
  - - [2368, 5888, 1, 256, 2368, 2368, 2368, 256]
    - [23, 2589.47]
  - - [512, 24000, 1, 1536, 512, 512, 512, 1536]
    - [34, 5264.52]
  - - [5888, 1856, 1, 3328, 5888, 5888, 5888, 3328]
    - [34, 3881.51]
  - - [5888, 2944, 1, 3328, 5888, 5888, 5888, 3328]
    - [49, 4486.44]
  - - [1856, 4288, 1, 256, 1856, 1856, 1856, 256]
    - [0, 2237.16]
  - - [5056, 5056, 1, 3328, 5056, 5056, 5056, 3328]
    - [56, 5328.6]
  - - [1408, 5888, 1, 1280, 1408, 1408, 1408, 1280]
    - [71, 2719.25]
  - - [6144, 6000, 1, 2560, 6144, 6144, 6144, 2560]
    - [23, 4476.68]
  - - [1024, 3584, 1, 3328, 1024, 1024, 1024, 3328]
    - [39, 3750.66]
  - - [512, 48000, 1, 2048, 512, 512, 512, 2048]
    - [34, 4810.15]
  - - [448, 3584, 1, 3328, 448, 448, 448, 3328]
    - [34, 2661.72]
  - - [5888, 1408, 1, 1280, 5888, 5888, 5888, 1280]
    - [33, 3592.95]
  - - [1024, 2368, 1, 256, 1024, 1024, 1024, 256]
    - [0, 1948.6]
  - - [5056, 6784, 1, 1280, 5056, 5056, 5056, 1280]
    - [59, 3928.22]
  - - [5056, 5056, 1, 1280, 5056, 5056, 5056, 1280]
    - [26, 3858.56]
  - - [4288, 6784, 1, 256, 4288, 4288, 4288, 256]
    - [42, 2946.88]
  - - [6784, 448, 1, 256, 6784, 6784, 6784, 256]
    - [30, 1352.66]
  - - [5056, 256, 1, 1280, 5056, 5056, 5056, 1280]
    - [34, 1736.47]
  - - [5888, 704, 1, 1280, 5888, 5888, 5888, 1280]
    - [5, 3259.34]
  - - [3584, 1024, 1, 256, 3584, 3584, 3584, 256]
    - [18, 1442.05]
  - - [6784, 4288, 1, 3328, 6784, 6784, 6784, 3328]
    - [55, 4500.75]
  - - [1856, 2368, 1, 3328, 1856, 1856, 1856, 3328]
    - [33, 3797.02]
  - - [5888, 2944, 1, 1280, 5888, 5888, 5888, 1280]
    - [68, 3606.43]
  - - [5888, 1024, 1, 256, 5888, 5888, 5888, 256]
    - [52, 1825.34]
  - - [1408, 2944, 1, 256, 1408, 1408, 1408, 256]
    - [36, 1430.88]
  - - [6784, 5056, 1, 3328, 6784, 6784, 6784, 3328]
    - [47, 4628.22]
  - - [5056, 5056, 1, 256, 5056, 5056, 5056, 256]
    - [74, 3692.39]
  - - [1024, 3584, 1, 1280, 1024, 1024, 1024, 1280]
    - [48, 2972.41]
  - - [2368, 2944, 1, 1280, 2368, 2368, 2368, 1280]
    - [63, 5426.37]
  - - [6784, 6784, 1, 1280, 6784, 6784, 6784, 1280]
    - [36, 5196.87]
  - - [1408, 4288, 1, 1280, 1408, 1408, 1408, 1280]
    - [53, 3426.21]
  - - [3584, 4288, 1, 1280, 3584, 3584, 3584, 1280]
    - [9, 3596.88]
  - - [512, 6000, 1, 2560, 512, 512, 512, 2560]
    - [34, 2988.71]
  - - [2368, 704, 1, 1280, 2368, 2368, 2368, 1280]
    - [25, 2305.68]
  - - [5056, 4288, 1, 3328, 5056, 5056, 5056, 3328]
    - [15, 4555.88]
  - - [3584, 2368, 1, 3328, 3584, 3584, 3584, 3328]
    - [45, 3912.47]
  - - [5888, 6784, 1, 1280, 5888, 5888, 5888, 1280]
    - [47, 5070.5]
  - - [6784, 448, 1, 1280, 6784, 6784, 6784, 1280]
    - [29, 6314.96]
  - - [2944, 5888, 1, 256, 2944, 2944, 2944, 256]
    - [41, 2999.18]
  - - [4288, 2944, 1, 256, 4288, 4288, 4288, 256]
    - [37, 2407.08]
  - - [6144, 24000, 1, 2560, 6144, 6144, 6144, 2560]
    - [52, 4897.61]
  - - [5056, 2368, 1, 1280, 5056, 5056, 5056, 1280]
    - [39, 3571.35]
  - - [448, 3584, 1, 1280, 448, 448, 448, 1280]
    - [35, 2029.61]
  - - [6784, 5888, 1, 256, 6784, 6784, 6784, 256]
    - [10, 4207.48]
  - - [1024, 1408, 1, 256, 1024, 1024, 1024, 256]
    - [33, 5559.89]
  - - [2368, 2368, 1, 3328, 2368, 2368, 2368, 3328]
    - [56, 4106.88]
  - - [5056, 704, 1, 3328, 5056, 5056, 5056, 3328]
    - [56, 3440.99]
  - - [1408, 1856, 1, 256, 1408, 1408, 1408, 256]
    - [0, 1948.18]
  - - [5888, 1856, 1, 256, 5888, 5888, 5888, 256]
    - [10, 2326.5]
  - - [704, 5888, 1, 256, 704, 704, 704, 256]
    - [0, 1397.32]
  - - [3584, 704, 1, 3328, 3584, 3584, 3584, 3328]
    - [78, 4240.82]
  - - [1408, 1408, 1, 256, 1408, 1408, 1408, 256]
    - [0, 1901.59]
  - - [448, 4288, 1, 256, 448, 448, 448, 256]
    - [11, 4547.39]
  - - [704, 2368, 1, 1280, 704, 704, 704, 1280]
    - [26, 4653.86]
  - - [1856, 2368, 1, 1280, 1856, 1856, 1856, 1280]
    - [39, 3455.67]
  - - [1408, 1408, 1, 3328, 1408, 1408, 1408, 3328]
    - [49, 2878.55]
  - - [256, 193600, 1, 64, 256, 256, 256, 64]
    - [35, 1872.95]
  - - [1408, 1024, 1, 1280, 1408, 1408, 1408, 1280]
    - [39, 5010.56]
  - - [704, 6784, 1, 256, 704, 704, 704, 256]
    - [68, 1729.21]
  - - [6784, 704, 1, 256, 6784, 6784, 6784, 256]
    - [15, 1708.26]
  - - [2048, 7000, 1, 2048, 2048, 2048, 2048, 2048]
    - [34, 3801.62]
  - - [5056, 704, 1, 256, 5056, 5056, 5056, 256]
    - [1, 2824.95]
  - - [1408, 3584, 1, 256, 1408, 1408, 1408, 256]
    - [4, 1723.79]
  - - [3584, 4288, 1, 3328, 3584, 3584, 3584, 3328]
    - [18, 5067.73]
  - - [5888, 1856, 1, 1280, 5888, 5888, 5888, 1280]
    - [62, 3392.73]
  - - [2368, 3584, 1, 1280, 2368, 2368, 2368, 1280]
    - [56, 3490.92]
  - - [2944, 3584, 1, 3328, 2944, 2944, 2944, 3328]
    - [35, 4800.6]
  - - [6784, 2944, 1, 256, 6784, 6784, 6784, 256]
    - [27, 3119.99]
  - - [1024, 1500, 1, 2560, 1024, 1024, 1024, 2560]
    - [46, 2583.42]
  - - [1856, 2368, 1, 256, 1856, 1856, 1856, 256]
    - [0, 1933.82]
  - - [3584, 6784, 1, 3328, 3584, 3584, 3584, 3328]
    - [34, 2758.05]
  - - [5056, 4288, 1, 1280, 5056, 5056, 5056, 1280]
    - [47, 3850.43]
  - - [6784, 1856, 1, 3328, 6784, 6784, 6784, 3328]
    - [33, 3616.81]
  - - [1408, 5056, 1, 1280, 1408, 1408, 1408, 1280]
    - [35, 2915.45]
  - - [196, 1024, 64, 256, 196, 196, 196, 256]
    - [54, 1898.05]
  - - [6784, 5888, 1, 3328, 6784, 6784, 6784, 3328]
    - [48, 4744.25]
  - - [2368, 5056, 1, 1280, 2368, 2368, 2368, 1280]
    - [3, 2997.06]
  - - [1024, 5056, 1, 1280, 1024, 1024, 1024, 1280]
    - [36, 3059.58]
  - - [4288, 1024, 1, 256, 4288, 4288, 4288, 256]
    - [69, 1509.99]
  - - [2368, 1408, 1, 256, 2368, 2368, 2368, 256]
    - [0, 2008.58]
  - - [5888, 448, 1, 1280, 5888, 5888, 5888, 1280]
    - [37, 2675.51]
  - - [704, 5888, 1, 3328, 704, 704, 704, 3328]
    - [14, 2962.74]
  - - [1024, 6784, 1, 1280, 1024, 1024, 1024, 1280]
    - [69, 2814.24]
  - - [3584, 2944, 1, 1280, 3584, 3584, 3584, 1280]
    - [2, 2943.46]
  - - [512, 6000, 1, 2816, 512, 512, 512, 2816]
    - [47, 3918.89]
  - - [512, 24000, 1, 2048, 512, 512, 512, 2048]
    - [56, 4511.39]
  - - [1408, 5056, 1, 3328, 1408, 1408, 1408, 3328]
    - [77, 3219.58]
  - - [1856, 1856, 1, 3328, 1856, 1856, 1856, 3328]
    - [40, 2558.11]
  - - [2368, 2368, 1, 256, 2368, 2368, 2368, 256]
    - [37, 1844.61]
  - - [4288, 4288, 1, 1280, 4288, 4288, 4288, 1280]
    - [69, 4102.55]
  - - [5888, 1024, 1, 1280, 5888, 5888, 5888, 1280]
    - [48, 3149.74]
  - - [1024, 12544, 1, 256, 1024, 1024, 1024, 256]
    - [35, 2369.89]
  - - [512, 48000, 1, 2560, 512, 512, 512, 2560]
    - [51, 4200.95]
  - - [704, 6784, 1, 3328, 704, 704, 704, 3328]
    - [82, 4448.5]
  - - [5888, 5888, 1, 3328, 5888, 5888, 5888, 3328]
    - [17, 4477.99]
  - - [5056, 1024, 1, 1280, 5056, 5056, 5056, 1280]
    - [46, 3007.69]
  - - [448, 5888, 1, 3328, 448, 448, 448, 3328]
    - [48, 2506.15]
  - - [1024, 2944, 1, 1280, 1024, 1024, 1024, 1280]
    - [36, 2901.15]
  - - [5056, 5888, 1, 1280, 5056, 5056, 5056, 1280]
    - [50, 4006.89]
  - - [448, 6784, 1, 256, 448, 448, 448, 256]
    - [0, 1722.02]
  - - [3584, 5888, 1, 256, 3584, 3584, 3584, 256]
    - [53, 2886.2]
  - - [2944, 3584, 1, 256, 2944, 2944, 2944, 256]
    - [44, 2184.79]
  - - [3072, 1500, 1, 1024, 3072, 3072, 3072, 1024]
    - [48, 2947.19]
  - - [6784, 1024, 1, 3328, 6784, 6784, 6784, 3328]
    - [11, 3357.96]
  - - [6784, 2944, 1, 3328, 6784, 6784, 6784, 3328]
    - [47, 4249.06]
  - - [6784, 2368, 1, 1280, 6784, 6784, 6784, 1280]
    - [25, 2597.62]
  - - [4288, 3584, 1, 256, 4288, 4288, 4288, 256]
    - [49, 2643.45]
  - - [4288, 5888, 1, 1280, 4288, 4288, 4288, 1280]
    - [34, 3614.63]
  - - [1024, 6000, 1, 1536, 1024, 1024, 1024, 1536]
    - [48, 3440.24]
  - - [4288, 1856, 1, 1280, 4288, 4288, 4288, 1280]
    - [63, 2804.89]
  - - [1856, 2944, 1, 3328, 1856, 1856, 1856, 3328]
    - [27, 3014.5]
  - - [256, 6784, 1, 3328, 256, 256, 256, 3328]
    - [15, 2916.84]
  - - [512, 3000, 1, 1536, 512, 512, 512, 1536]
    - [22, 2107.88]
  - - [5056, 1024, 1, 256, 5056, 5056, 5056, 256]
    - [2, 1775.96]
  - - [5056, 1856, 1, 3328, 5056, 5056, 5056, 3328]
    - [37, 3684.5]
  - - [4096, 7000, 1, 4096, 4096, 4096, 4096, 4096]
    - [32, 3885.97]
  - - [5056, 256, 1, 3328, 5056, 5056, 5056, 3328]
    - [35, 2749.12]
  - - [1024, 5888, 1, 1280, 1024, 1024, 1024, 1280]
    - [48, 2975.01]
  - - [5056, 3584, 1, 256, 5056, 5056, 5056, 256]
    - [39, 2975.9]
  - - [1856, 1024, 1, 1280, 1856, 1856, 1856, 1280]
    - [43, 2314.02]
  - - [1856, 1856, 1, 1280, 1856, 1856, 1856, 1280]
    - [38, 3172.56]
  - - [3072, 24000, 1, 1024, 3072, 3072, 3072, 1024]
    - [40, 4131.1]
  - - [1856, 1024, 1, 3328, 1856, 1856, 1856, 3328]
    - [36, 2983.84]
  - - [6784, 1024, 1, 256, 6784, 6784, 6784, 256]
    - [17, 1951.1]
  - - [5056, 5888, 1, 3328, 5056, 5056, 5056, 3328]
    - [16, 4267.85]
  - - [1856, 1024, 1, 256, 1856, 1856, 1856, 256]
    - [0, 1842.94]
  - - [512, 48000, 1, 1536, 512, 512, 512, 1536]
    - [51, 4076.49]
  - - [5056, 1408, 1, 3328, 5056, 5056, 5056, 3328]
    - [37, 3514.46]
  - - [448, 5888, 1, 256, 448, 448, 448, 256]
    - [0, 1175.32]
  - - [1408, 6784, 1, 3328, 1408, 1408, 1408, 3328]
    - [56, 3859.24]
  - - [1024, 24000, 1, 2560, 1024, 1024, 1024, 2560]
    - [56, 4075.9]
  - - [2944, 1408, 1, 3328, 2944, 2944, 2944, 3328]
    - [34, 3291.95]
  - - [2944, 4288, 1, 3328, 2944, 2944, 2944, 3328]
    - [27, 3767.05]
  - - [5056, 2944, 1, 256, 5056, 5056, 5056, 256]
    - [66, 2751.65]
  - - [2368, 1856, 1, 256, 2368, 2368, 2368, 256]
    - [26, 1709.21]
  - - [1408, 3584, 1, 3328, 1408, 1408, 1408, 3328]
    - [52, 4928.45]
  - - [2368, 6784, 1, 256, 2368, 2368, 2368, 256]
    - [40, 5619.48]
  - - [4288, 2368, 1, 3328, 4288, 4288, 4288, 3328]
    - [83, 4607.99]
  - - [704, 3584, 1, 1280, 704, 704, 704, 1280]
    - [45, 6096.28]
  - - [1408, 5888, 1, 3328, 1408, 1408, 1408, 3328]
    - [68, 4287.14]
  - - [1856, 5056, 1, 256, 1856, 1856, 1856, 256]
    - [12, 5201.8]
  - - [6784, 6784, 1, 256, 6784, 6784, 6784, 256]
    - [75, 3971.59]
  - - [2368, 4288, 1, 1280, 2368, 2368, 2368, 1280]
    - [15, 4704.09]
  - - [3584, 1856, 1, 1280, 3584, 3584, 3584, 1280]
    - [16, 3854.69]
  - - [8448, 48000, 1, 2816, 8448, 8448, 8448, 2816]
    - [56, 5655.01]
  - - [512, 6000, 1, 2048, 512, 512, 512, 2048]
    - [34, 2703.17]
  - - [3584, 448, 1, 256, 3584, 3584, 3584, 256]
    - [44, 2364.07]
  - - [3584, 3584, 1, 1280, 3584, 3584, 3584, 1280]
    - [25, 3185.72]
  - - [256, 6784, 1, 256, 256, 256, 256, 256]
    - [0, 1422.37]
  - - [1856, 3584, 1, 3328, 1856, 1856, 1856, 3328]
    - [36, 2844.5]
  - - [3584, 3584, 1, 256, 3584, 3584, 3584, 256]
    - [53, 2212.67]
  - - [6784, 4288, 1, 1280, 6784, 6784, 6784, 1280]
    - [25, 3729.82]
  - - [3584, 5056, 1, 256, 3584, 3584, 3584, 256]
    - [52, 2442.32]
  - - [2944, 2368, 1, 1280, 2944, 2944, 2944, 1280]
    - [27, 2844.98]
  - - [6784, 3584, 1, 256, 6784, 6784, 6784, 256]
    - [43, 2992.21]
  - - [1856, 1408, 1, 256, 1856, 1856, 1856, 256]
    - [75, 2575.58]
  - - [2944, 2944, 1, 3328, 2944, 2944, 2944, 3328]
    - [47, 3119.86]
  - - [5056, 6784, 1, 256, 5056, 5056, 5056, 256]
    - [10, 3348.66]
  - - [1408, 4288, 1, 3328, 1408, 1408, 1408, 3328]
    - [47, 3735.2]
  - - [6784, 256, 1, 1280, 6784, 6784, 6784, 1280]
    - [43, 2082.43]
  - - [2368, 704, 1, 3328, 2368, 2368, 2368, 3328]
    - [36, 2471.17]
  - - [3584, 6784, 1, 256, 3584, 3584, 3584, 256]
    - [15, 2395.17]
  - - [5056, 1856, 1, 256, 5056, 5056, 5056, 256]
    - [53, 3386.32]
  - - [1024, 3000, 1, 2816, 1024, 1024, 1024, 2816]
    - [5, 3970.56]
  - - [704, 4288, 1, 256, 704, 704, 704, 256]
    - [56, 1346.78]
  - - [1408, 6784, 1, 1280, 1408, 1408, 1408, 1280]
    - [48, 3780.88]
  - - [7680, 24000, 1, 2560, 7680, 7680, 7680, 2560]
    - [35, 2999.24]
  - - [4608, 48000, 1, 1536, 4608, 4608, 4608, 1536]
    - [61, 3295.98]
  - - [1024, 24000, 1, 1536, 1024, 1024, 1024, 1536]
    - [36, 2640.64]
  - - [5056, 2368, 1, 3328, 5056, 5056, 5056, 3328]
    - [49, 2604.65]
  - - [2944, 4288, 1, 256, 2944, 2944, 2944, 256]
    - [41, 2305.11]
  - - [1408, 3584, 1, 1280, 1408, 1408, 1408, 1280]
    - [36, 2771.09]
  - - [1024, 1500, 1, 2816, 1024, 1024, 1024, 2816]
    - [47, 2509.27]
  - - [1024, 6000, 1, 2048, 1024, 1024, 1024, 2048]
    - [34, 2820.66]
  - - [512, 24000, 1, 2560, 512, 512, 512, 2560]
    - [24, 3298.18]
  - - [6144, 3000, 1, 2560, 6144, 6144, 6144, 2560]
    - [36, 3475.13]
  - - [2368, 6784, 1, 3328, 2368, 2368, 2368, 3328]
    - [77, 3127.58]
  - - [5056, 704, 1, 1280, 5056, 5056, 5056, 1280]
    - [37, 2566.7]
  - - [1856, 4288, 1, 3328, 1856, 1856, 1856, 3328]
    - [36, 2603.37]
  - - [1408, 5888, 1, 256, 1408, 1408, 1408, 256]
    - [0, 2071.17]
  - - [704, 2944, 1, 1280, 704, 704, 704, 1280]
    - [46, 2142.47]
  - - [3584, 704, 1, 1280, 3584, 3584, 3584, 1280]
    - [25, 2265.85]
  - - [5888, 5056, 1, 256, 5888, 5888, 5888, 256]
    - [53, 2749.32]
  - - [3584, 448, 1, 3328, 3584, 3584, 3584, 3328]
    - [81, 2548.17]
  - - [704, 2368, 1, 3328, 704, 704, 704, 3328]
    - [48, 2430.89]
  - - [448, 5056, 1, 3328, 448, 448, 448, 3328]
    - [46, 2445.15]
  - - [4288, 448, 1, 256, 4288, 4288, 4288, 256]
    - [0, 1268.93]
  - - [5888, 2368, 1, 256, 5888, 5888, 5888, 256]
    - [18, 2415.14]
  - - [6784, 704, 1, 3328, 6784, 6784, 6784, 3328]
    - [36, 2575.05]
  - - [1408, 2944, 1, 3328, 1408, 1408, 1408, 3328]
    - [47, 2589.46]
  - - [4288, 4288, 1, 256, 4288, 4288, 4288, 256]
    - [31, 2626.42]
  - - [2368, 704, 1, 256, 2368, 2368, 2368, 256]
    - [0, 1748.02]
  - - [3584, 2368, 1, 256, 3584, 3584, 3584, 256]
    - [18, 1846.72]
  - - [5888, 5056, 1, 1280, 5888, 5888, 5888, 1280]
    - [48, 2791.73]
  - - [8448, 24000, 1, 2816, 8448, 8448, 8448, 2816]
    - [36, 4135.69]
  - - [3584, 3584, 1, 3328, 3584, 3584, 3584, 3328]
    - [79, 3044.2]
  - - [3072, 1500, 1, 128, 3072, 3072, 3072, 128]
    - [0, 1900.15]
  - - [2048, 3136, 1, 512, 2048, 2048, 2048, 512]
    - [49, 2221.67]
  - - [5888, 6784, 1, 256, 5888, 5888, 5888, 256]
    - [18, 3244.07]
  - - [4288, 2944, 1, 3328, 4288, 4288, 4288, 3328]
    - [48, 3389.93]
  - - [256, 5056, 1, 1280, 256, 256, 256, 1280]
    - [21, 1840.18]
  - - [6784, 5888, 1, 1280, 6784, 6784, 6784, 1280]
    - [36, 3421.27]
  - - [5888, 4288, 1, 1280, 5888, 5888, 5888, 1280]
    - [48, 3493.24]
  - - [1024, 24000, 1, 2048, 1024, 1024, 1024, 2048]
    - [46, 2739.56]
  - - [1408, 1856, 1, 1280, 1408, 1408, 1408, 1280]
    - [64, 2309.22]
  - - [5888, 448, 1, 3328, 5888, 5888, 5888, 3328]
    - [20, 2812.69]
  - - [704, 5888, 1, 1280, 704, 704, 704, 1280]
    - [48, 2757.53]
  - - [5056, 2944, 1, 3328, 5056, 5056, 5056, 3328]
    - [36, 2962.04]
  - - [448, 4288, 1, 1280, 448, 448, 448, 1280]
    - [21, 2126.72]
  - - [3584, 704, 1, 256, 3584, 3584, 3584, 256]
    - [0, 1370.45]
  - - [3584, 1408, 1, 3328, 3584, 3584, 3584, 3328]
    - [79, 2963.0]
  - - [2368, 1024, 1, 1280, 2368, 2368, 2368, 1280]
    - [25, 2316.04]
  - - [2944, 6784, 1, 1280, 2944, 2944, 2944, 1280]
    - [7, 3200.97]
  - - [1856, 6784, 1, 256, 1856, 1856, 1856, 256]
    - [0, 2627.51]
  - - [4288, 448, 1, 3328, 4288, 4288, 4288, 3328]
    - [55, 2821.36]
  - - [6784, 704, 1, 1280, 6784, 6784, 6784, 1280]
    - [29, 2811.0]
  - - [5888, 1024, 1, 3328, 5888, 5888, 5888, 3328]
    - [47, 3251.49]
  - - [704, 6784, 1, 1280, 704, 704, 704, 1280]
    - [48, 2987.47]
  - - [512, 3000, 1, 2048, 512, 512, 512, 2048]
    - [46, 2368.37]
  - - [5056, 1024, 1, 3328, 5056, 5056, 5056, 3328]
    - [13, 3040.35]
  - - [704, 5056, 1, 1280, 704, 704, 704, 1280]
    - [46, 2463.69]
  - - [2944, 1856, 1, 256, 2944, 2944, 2944, 256]
    - [37, 2015.61]
  - - [5888, 5056, 1, 3328, 5888, 5888, 5888, 3328]
    - [78, 3817.21]
  - - [3584, 6784, 1, 1280, 3584, 3584, 3584, 1280]
    - [48, 2737.53]
  - - [1856, 5888, 1, 256, 1856, 1856, 1856, 256]
    - [0, 2399.94]
  - - [4288, 4288, 1, 3328, 4288, 4288, 4288, 3328]
    - [78, 3531.17]
  - - [4288, 1408, 1, 1280, 4288, 4288, 4288, 1280]
    - [16, 2824.06]
  - - [4288, 2368, 1, 256, 4288, 4288, 4288, 256]
    - [42, 2081.99]
  - - [2944, 5056, 1, 1280, 2944, 2944, 2944, 1280]
    - [48, 3267.79]
  - - [6784, 2368, 1, 3328, 6784, 6784, 6784, 3328]
    - [68, 3068.39]
  - - [4288, 1856, 1, 3328, 4288, 4288, 4288, 3328]
    - [79, 2908.84]
  - - [1856, 2944, 1, 1280, 1856, 1856, 1856, 1280]
    - [29, 2691.46]
  - - [4288, 6784, 1, 3328, 4288, 4288, 4288, 3328]
    - [47, 2685.92]
  - - [3584, 1024, 1, 1280, 3584, 3584, 3584, 1280]
    - [25, 2508.03]
  - - [1024, 4288, 1, 256, 1024, 1024, 1024, 256]
    - [0, 1920.76]
  - - [5888, 3584, 1, 3328, 5888, 5888, 5888, 3328]
    - [35, 2781.9]
  - - [5056, 3584, 1, 3328, 5056, 5056, 5056, 3328]
    - [48, 2791.3]
  - - [2368, 1408, 1, 1280, 2368, 2368, 2368, 1280]
    - [29, 2555.73]
  - - [5056, 2944, 1, 1280, 5056, 5056, 5056, 1280]
    - [78, 3002.42]
  - - [8448, 6000, 1, 2816, 8448, 8448, 8448, 2816]
    - [50, 2724.12]
  - - [1024, 6784, 1, 256, 1024, 1024, 1024, 256]
    - [60, 1900.91]
  - - [2944, 5056, 1, 3328, 2944, 2944, 2944, 3328]
    - [36, 2740.79]
  - - [3584, 2944, 1, 256, 3584, 3584, 3584, 256]
    - [54, 2053.61]
  - - [5056, 6784, 1, 3328, 5056, 5056, 5056, 3328]
    - [14, 3160.62]
  - - [3584, 4288, 1, 256, 3584, 3584, 3584, 256]
    - [15, 2259.55]
  - - [1856, 6784, 1, 3328, 1856, 1856, 1856, 3328]
    - [36, 2637.52]
  - - [512, 6000, 1, 1536, 512, 512, 512, 1536]
    - [12, 2324.08]
  - - [5056, 1408, 1, 1280, 5056, 5056, 5056, 1280]
    - [29, 3449.43]
  - - [5888, 5888, 1, 256, 5888, 5888, 5888, 256]
    - [65, 2862.81]
  - - [4288, 1024, 1, 1280, 4288, 4288, 4288, 1280]
    - [29, 2699.14]
  - - [448, 6784, 1, 3328, 448, 448, 448, 3328]
    - [48, 2956.85]
  - - [2944, 1408, 1, 1280, 2944, 2944, 2944, 1280]
    - [49, 2704.21]
  - - [3072, 6000, 1, 1024, 3072, 3072, 3072, 1024]
    - [70, 2982.96]
  - - [2944, 1856, 1, 3328, 2944, 2944, 2944, 3328]
    - [36, 2507.5]
  - - [448, 5056, 1, 256, 448, 448, 448, 256]
    - [0, 1546.91]
  - - [3584, 5888, 1, 1280, 3584, 3584, 3584, 1280]
    - [51, 2789.27]
  - - [6784, 1856, 1, 1280, 6784, 6784, 6784, 1280]
    - [2, 2873.52]
  - - [5888, 256, 1, 3328, 5888, 5888, 5888, 3328]
    - [36, 2807.57]
  - - [1856, 5888, 1, 3328, 1856, 1856, 1856, 3328]
    - [69, 2925.21]
  - - [3584, 1408, 1, 256, 3584, 3584, 3584, 256]
    - [7, 1523.0]
  - - [704, 3584, 1, 3328, 704, 704, 704, 3328]
    - [48, 2699.23]
  - - [5056, 448, 1, 1280, 5056, 5056, 5056, 1280]
    - [64, 2279.57]
  - - [3584, 1856, 1, 3328, 3584, 3584, 3584, 3328]
    - [49, 2617.75]
  - - [1024, 3000, 1, 2048, 1024, 1024, 1024, 2048]
    - [34, 2777.98]
  - - [2944, 1024, 1, 256, 2944, 2944, 2944, 256]
    - [0, 1471.1]
  - - [2368, 4288, 1, 3328, 2368, 2368, 2368, 3328]
    - [47, 3026.32]
  - - [1024, 1408, 1, 1280, 1024, 1024, 1024, 1280]
    - [45, 1811.7]
  - - [6784, 5056, 1, 256, 6784, 6784, 6784, 256]
    - [41, 2836.05]
  - - [4288, 5888, 1, 256, 4288, 4288, 4288, 256]
    - [67, 2899.33]
  - - [2944, 6784, 1, 256, 2944, 2944, 2944, 256]
    - [31, 2655.48]
  - - [2368, 2368, 1, 1280, 2368, 2368, 2368, 1280]
    - [37, 2784.29]
  - - [1856, 3584, 1, 1280, 1856, 1856, 1856, 1280]
    - [64, 2747.67]
  - - [3584, 1408, 1, 1280, 3584, 3584, 3584, 1280]
    - [25, 2651.86]
  - - [5056, 3584, 1, 1280, 5056, 5056, 5056, 1280]
    - [30, 2971.7]
  - - [256, 5888, 1, 256, 256, 256, 256, 256]
    - [0, 1633.48]
  - - [1856, 1408, 1, 3328, 1856, 1856, 1856, 3328]
    - [36, 2484.43]
  - - [1024, 4288, 1, 3328, 1024, 1024, 1024, 3328]
    - [48, 2715.85]
  - - [2944, 2368, 1, 3328, 2944, 2944, 2944, 3328]
    - [49, 2601.35]
  - - [704, 4288, 1, 3328, 704, 704, 704, 3328]
    - [36, 2622.02]
  - - [1024, 48000, 1, 2816, 1024, 1024, 1024, 2816]
    - [77, 3848.29]
  - - [1024, 1856, 1, 1280, 1024, 1024, 1024, 1280]
    - [11, 2055.79]
  - - [6784, 1856, 1, 256, 6784, 6784, 6784, 256]
    - [39, 2389.73]
  - - [512, 48000, 1, 2816, 512, 512, 512, 2816]
    - [46, 2901.65]
  - - [512, 3000, 1, 2816, 512, 512, 512, 2816]
    - [48, 2546.49]
  - - [1024, 5888, 1, 256, 1024, 1024, 1024, 256]
    - [12, 1739.54]
  - - [1408, 2368, 1, 256, 1408, 1408, 1408, 256]
    - [0, 1961.32]
  - - [2944, 704, 1, 3328, 2944, 2944, 2944, 3328]
    - [55, 2795.75]
  - - [2944, 2944, 1, 1280, 2944, 2944, 2944, 1280]
    - [64, 2762.64]
  - - [6784, 256, 1, 3328, 6784, 6784, 6784, 3328]
    - [44, 2636.76]
  - - [1408, 5056, 1, 256, 1408, 1408, 1408, 256]
    - [22, 2146.58]
  - - [512, 50176, 1, 128, 512, 512, 512, 128]
    - [11, 1899.74]
  - - [1408, 4288, 1, 256, 1408, 1408, 1408, 256]
    - [25, 1802.38]
  - - [5888, 2368, 1, 1280, 5888, 5888, 5888, 1280]
    - [27, 3125.17]
  - - [2368, 5888, 1, 1280, 2368, 2368, 2368, 1280]
    - [68, 3041.3]
  - - [5888, 256, 1, 1280, 5888, 5888, 5888, 1280]
    - [49, 1955.15]
  - - [2368, 1856, 1, 3328, 2368, 2368, 2368, 3328]
    - [12, 2544.86]
  - - [2944, 704, 1, 256, 2944, 2944, 2944, 256]
    - [0, 1467.91]
  - - [2368, 6784, 1, 1280, 2368, 2368, 2368, 1280]
    - [25, 3340.54]
  - - [2368, 1024, 1, 3328, 2368, 2368, 2368, 3328]
    - [13, 2640.12]
  - - [1856, 4288, 1, 1280, 1856, 1856, 1856, 1280]
    - [25, 2977.29]
  - - [704, 3584, 1, 256, 704, 704, 704, 256]
    - [0, 1325.89]
  - - [704, 2944, 1, 3328, 704, 704, 704, 3328]
    - [47, 2639.87]
  - - [1856, 5056, 1, 3328, 1856, 1856, 1856, 3328]
    - [68, 2854.05]
  - - [196, 256, 64, 1024, 196, 196, 196, 1024]
    - [57, 1383.21]
  - - [3584, 5056, 1, 1280, 3584, 3584, 3584, 1280]
    - [25, 3310.01]
  - - [2944, 1024, 1, 3328, 2944, 2944, 2944, 3328]
    - [68, 2740.32]
  - - [1408, 6784, 1, 256, 1408, 1408, 1408, 256]
    - [1, 2230.76]
  - - [6784, 1408, 1, 3328, 6784, 6784, 6784, 3328]
    - [49, 2672.17]
  - - [1024, 2368, 1, 1280, 1024, 1024, 1024, 1280]
    - [46, 2229.29]
  - - [6784, 2944, 1, 1280, 6784, 6784, 6784, 1280]
    - [25, 3606.67]
  - - [3584, 448, 1, 1280, 3584, 3584, 3584, 1280]
    - [43, 1845.22]
  - - [2944, 6784, 1, 3328, 2944, 2944, 2944, 3328]
    - [48, 2674.58]
  - - [448, 5056, 1, 1280, 448, 448, 448, 1280]
    - [57, 2256.5]
  - - [4288, 5056, 1, 1280, 4288, 4288, 4288, 1280]
    - [52, 3057.27]
  - - [4288, 704, 1, 256, 4288, 4288, 4288, 256]
    - [22, 1314.07]
  - - [5888, 704, 1, 256, 5888, 5888, 5888, 256]
    - [64, 1478.11]
  - - [256, 5888, 1, 3328, 256, 256, 256, 3328]
    - [54, 2533.07]
  - - [6784, 4288, 1, 256, 6784, 6784, 6784, 256]
    - [71, 2877.08]
  - - [5888, 256, 1, 256, 5888, 5888, 5888, 256]
    - [7, 1315.47]
  - - [6784, 1024, 1, 1280, 6784, 6784, 6784, 1280]
    - [3, 3095.43]
  - - [2944, 704, 1, 1280, 2944, 2944, 2944, 1280]
    - [37, 2092.35]
  - - [6784, 3584, 1, 1280, 6784, 6784, 6784, 1280]
    - [78, 3248.73]
  - - [1408, 2944, 1, 1280, 1408, 1408, 1408, 1280]
    - [29, 2583.76]
  - - [1408, 2368, 1, 3328, 1408, 1408, 1408, 3328]
    - [47, 3050.39]
  - - [2368, 2944, 1, 256, 2368, 2368, 2368, 256]
    - [43, 1838.19]
  - - [3584, 1856, 1, 256, 3584, 3584, 3584, 256]
    - [15, 1767.02]
  - - [4288, 3584, 1, 1280, 4288, 4288, 4288, 1280]
    - [50, 2740.5]
  - - [4288, 2944, 1, 1280, 4288, 4288, 4288, 1280]
    - [25, 3297.0]
  - - [5056, 448, 1, 3328, 5056, 5056, 5056, 3328]
    - [47, 2794.61]
  - - [5124, 1500, 1, 2048, 5124, 5124, 5124, 2048]
    - [69, 2523.59]
  - - [4288, 5056, 1, 3328, 4288, 4288, 4288, 3328]
    - [47, 3271.7]
  - - [256, 5056, 1, 3328, 256, 256, 256, 3328]
    - [50, 2334.52]
  - - [5056, 2368, 1, 256, 5056, 5056, 5056, 256]
    - [43, 2312.26]
  - - [4288, 704, 1, 3328, 4288, 4288, 4288, 3328]
    - [49, 2668.86]
  - - [448, 3584, 1, 256, 448, 448, 448, 256]
    - [0, 1285.68]
  - - [6144, 1500, 1, 2560, 6144, 6144, 6144, 2560]
    - [35, 2856.62]
  - - [1024, 1408, 1, 3328, 1024, 1024, 1024, 3328]
    - [48, 2388.23]
  - - [2944, 5888, 1, 1280, 2944, 2944, 2944, 1280]
    - [48, 3304.25]
  - - [5888, 3584, 1, 256, 5888, 5888, 5888, 256]
    - [53, 2683.7]
  - - [1408, 1856, 1, 3328, 1408, 1408, 1408, 3328]
    - [14, 2523.58]
  - - [7680, 6000, 1, 2560, 7680, 7680, 7680, 2560]
    - [78, 3235.28]
  - - [6784, 1408, 1, 1280, 6784, 6784, 6784, 1280]
    - [13, 2774.34]
  - - [512, 3000, 1, 2560, 512, 512, 512, 2560]
    - [34, 2395.28]
  - - [704, 2944, 1, 256, 704, 704, 704, 256]
    - [0, 1400.61]
  - - [2944, 5888, 1, 3328, 2944, 2944, 2944, 3328]
    - [36, 2821.82]
  - - [1024, 1500, 1, 1536, 1024, 1024, 1024, 1536]
    - [36, 1998.31]
  - - [1408, 1408, 1, 1280, 1408, 1408, 1408, 1280]
    - [3, 2123.19]
  - - [3072, 3000, 1, 1024, 3072, 3072, 3072, 1024]
    - [29, 2664.26]
  - - [448, 4288, 1, 3328, 448, 448, 448, 3328]
    - [46, 2420.69]
  - - [704, 2368, 1, 256, 704, 704, 704, 256]
    - [0, 1695.43]
  - - [5888, 2368, 1, 3328, 5888, 5888, 5888, 3328]
    - [77, 3447.9]
  - - [5124, 9124, 1, 1760, 5124, 5124, 5124, 1760]
    - [81, 3462.06]
  - - [4288, 5056, 1, 256, 4288, 4288, 4288, 256]
    - [41, 2804.96]
  - - [4288, 448, 1, 1280, 4288, 4288, 4288, 1280]
    - [64, 2100.32]
  - - [5888, 704, 1, 3328, 5888, 5888, 5888, 3328]
    - [36, 3188.48]
  - - [4288, 3584, 1, 3328, 4288, 4288, 4288, 3328]
    - [78, 3572.96]
  - - [1024, 6784, 1, 3328, 1024, 1024, 1024, 3328]
    - [76, 3024.26]
  - - [512, 3136, 1, 2048, 512, 512, 512, 2048]
    - [46, 2415.11]
  - - [1408, 1024, 1, 256, 1408, 1408, 1408, 256]
    - [0, 1418.52]
  - - [8448, 1500, 1, 2816, 8448, 8448, 8448, 2816]
    - [36, 3745.37]
  - - [2560, 7000, 1, 2560, 2560, 2560, 2560, 2560]
    - [47, 3132.56]
  - - [6784, 6784, 1, 3328, 6784, 6784, 6784, 3328]
    - [36, 3394.83]
  - - [704, 5056, 1, 3328, 704, 704, 704, 3328]
    - [47, 3302.91]
  - - [3584, 5056, 1, 3328, 3584, 3584, 3584, 3328]
    - [47, 3490.72]
  - - [2368, 2944, 1, 3328, 2368, 2368, 2368, 3328]
    - [77, 2957.75]
  - - [2368, 3584, 1, 256, 2368, 2368, 2368, 256]
    - [57, 2262.62]
  - - [4608, 3000, 1, 1536, 4608, 4608, 4608, 1536]
    - [69, 2774.44]
  - - [5124, 9124, 1, 4096, 5124, 5124, 5124, 4096]
    - [48, 4814.88]
  - - [7680, 48000, 1, 2560, 7680, 7680, 7680, 2560]
    - [45, 5330.54]
  - - [4608, 1500, 1, 1536, 4608, 4608, 4608, 1536]
    - [78, 3531.38]
  - - [3584, 2368, 1, 1280, 3584, 3584, 3584, 1280]
    - [3, 4800.92]
  - - [5124, 9124, 1, 2560, 5124, 5124, 5124, 2560]
    - [47, 5027.9]
  - - [1856, 1856, 1, 256, 1856, 1856, 1856, 256]
    - [22, 5792.15]
  - - [4288, 1408, 1, 3328, 4288, 4288, 4288, 3328]
    - [14, 3893.63]
  - - [5124, 9124, 1, 2048, 5124, 5124, 5124, 2048]
    - [11, 3504.96]
  - - [5124, 700, 1, 2048, 5124, 5124, 5124, 2048]
    - [36, 2493.84]
  - - [256, 12544, 1, 1024, 256, 256, 256, 1024]
    - [65, 5364.98]
  - - [5888, 1408, 1, 3328, 5888, 5888, 5888, 3328]
    - [48, 4302.52]
  - - [256, 5056, 1, 256, 256, 256, 256, 256]
    - [0, 1539.67]
  - - [2368, 5056, 1, 256, 2368, 2368, 2368, 256]
    - [50, 2457.18]
  - - [1024, 6000, 1, 2560, 1024, 1024, 1024, 2560]
    - [6, 3743.89]
  - - [1024, 5056, 1, 256, 1024, 1024, 1024, 256]
    - [23, 1784.51]
  - - [4224, 1500, 1, 176, 4224, 4224, 4224, 176]
    - [30, 1861.1]
  - - [2368, 1408, 1, 3328, 2368, 2368, 2368, 3328]
    - [78, 3354.59]
  - - [1024, 48000, 1, 1536, 1024, 1024, 1024, 1536]
    - [30, 4190.84]
  - - [5888, 448, 1, 256, 5888, 5888, 5888, 256]
    - [0, 1880.55]
  - - [6784, 5056, 1, 1280, 6784, 6784, 6784, 1280]
    - [37, 4032.29]
  - - [1024, 48000, 1, 2560, 1024, 1024, 1024, 2560]
    - [55, 4609.22]
  - - [4288, 6784, 1, 1280, 4288, 4288, 4288, 1280]
    - [13, 4324.19]
  - - [3072, 48000, 1, 1024, 3072, 3072, 3072, 1024]
    - [41, 4358.26]
  - - [6784, 1408, 1, 256, 6784, 6784, 6784, 256]
    - [29, 2481.52]
  - - [5888, 4288, 1, 256, 5888, 5888, 5888, 256]
    - [26, 3295.92]
  - - [5056, 5888, 1, 256, 5056, 5056, 5056, 256]
    - [29, 3244.29]
  - - [2368, 1024, 1, 256, 2368, 2368, 2368, 256]
    - [0, 1957.71]
  - - [1856, 6784, 1, 1280, 1856, 1856, 1856, 1280]
    - [50, 3804.48]
  - - [8448, 3000, 1, 2816, 8448, 8448, 8448, 2816]
    - [56, 5725.28]
  - - [6784, 448, 1, 3328, 6784, 6784, 6784, 3328]
    - [39, 4318.1]
  - - [5056, 1856, 1, 1280, 5056, 5056, 5056, 1280]
    - [58, 4596.99]
  - - [1408, 1024, 1, 3328, 1408, 1408, 1408, 3328]
    - [35, 2883.58]
  - - [7680, 1500, 1, 2560, 7680, 7680, 7680, 2560]
    - [56, 3993.82]
  - - [5888, 3584, 1, 1280, 5888, 5888, 5888, 1280]
    - [49, 5000.61]
  - - [1024, 2944, 1, 256, 1024, 1024, 1024, 256]
    - [24, 6015.96]
  - - [448, 6784, 1, 1280, 448, 448, 448, 1280]
    - [57, 5050.49]
  - - [704, 5056, 1, 256, 704, 704, 704, 256]
    - [37, 5687.79]
  - - [3584, 1024, 1, 3328, 3584, 3584, 3584, 3328]
    - [77, 4266.2]
  - - [2944, 1856, 1, 1280, 2944, 2944, 2944, 1280]
    - [15, 6273.88]
  - - [5056, 256, 1, 256, 5056, 5056, 5056, 256]
    - [27, 4986.72]
  - - [2368, 3584, 1, 3328, 2368, 2368, 2368, 3328]
    - [81, 4770.0]
  - - [3584, 5888, 1, 3328, 3584, 3584, 3584, 3328]
    - [19, 4968.59]
  - - [2944, 3584, 1, 1280, 2944, 2944, 2944, 1280]
    - [27, 6307.83]
  - - [1856, 5888, 1, 1280, 1856, 1856, 1856, 1280]
    - [8, 4137.54]
  - - [4608, 24000, 1, 1536, 4608, 4608, 4608, 1536]
    - [47, 5471.21]
  - - [4288, 1408, 1, 256, 4288, 4288, 4288, 256]
    - [9, 4866.75]
  - - [4288, 2368, 1, 1280, 4288, 4288, 4288, 1280]
    - [60, 4246.19]
  - - [2944, 5056, 1, 256, 2944, 2944, 2944, 256]
    - [28, 5363.56]
  - - [6784, 2368, 1, 256, 6784, 6784, 6784, 256]
    - [50, 3058.59]
  - - [1024, 24000, 1, 2816, 1024, 1024, 1024, 2816]
    - [36, 4461.22]
  - - [4288, 1856, 1, 256, 4288, 4288, 4288, 256]
    - [54, 1979.63]
  - - [1856, 2944, 1, 256, 1856, 1856, 1856, 256]
    - [29, 1857.78]
  - - [4608, 6000, 1, 1536, 4608, 4608, 4608, 1536]
    - [61, 4248.17]
  - - [7680, 3000, 1, 2560, 7680, 7680, 7680, 2560]
    - [56, 5023.53]
  - - [5124, 700, 1, 2560, 5124, 5124, 5124, 2560]
    - [9, 2502.53]
  - - [1856, 1408, 1, 1280, 1856, 1856, 1856, 1280]
    - [47, 4972.88]
  - - [1024, 4288, 1, 1280, 1024, 1024, 1024, 1280]
    - [7, 3144.56]
  - - [2368, 5056, 1, 3328, 2368, 2368, 2368, 3328]
    - [36, 4376.59]
  - - [4288, 1024, 1, 3328, 4288, 4288, 4288, 3328]
    - [18, 4647.23]
  - - [6144, 48000, 1, 2560, 6144, 6144, 6144, 2560]
    - [35, 5270.49]
  - - [1024, 5056, 1, 3328, 1024, 1024, 1024, 3328]
    - [35, 4579.22]
  - - [1024, 1856, 1, 3328, 1024, 1024, 1024, 3328]
    - [45, 2926.76]
  - - [5124, 1500, 1, 2560, 5124, 5124, 5124, 2560]
    - [23, 3960.19]
  - - [3584, 2944, 1, 3328, 3584, 3584, 3584, 3328]
    - [71, 4103.02]
  - - [5888, 2944, 1, 256, 5888, 5888, 5888, 256]
    - [68, 5317.89]
  - - [5056, 4288, 1, 256, 5056, 5056, 5056, 256]
    - [50, 5496.9]
  - - [1024, 3584, 1, 256, 1024, 1024, 1024, 256]
    - [0, 2001.66]
  - - [5056, 1408, 1, 256, 5056, 5056, 5056, 256]
    - [4, 2160.04]
  - - [5888, 5888, 1, 1280, 5888, 5888, 5888, 1280]
    - [14, 4262.53]
  - - [448, 5888, 1, 1280, 448, 448, 448, 1280]
    - [48, 2624.87]
  - - [1024, 3000, 1, 2560, 1024, 1024, 1024, 2560]
    - [24, 2727.13]
  - - [4288, 704, 1, 1280, 4288, 4288, 4288, 1280]
    - [71, 5183.53]
  - - [2944, 1408, 1, 256, 2944, 2944, 2944, 256]
    - [50, 5367.63]
  - - [2368, 5888, 1, 3328, 2368, 2368, 2368, 3328]
    - [72, 4646.7]
  - - [2368, 1856, 1, 1280, 2368, 2368, 2368, 1280]
    - [74, 4386.44]
  - - [1024, 6000, 1, 2816, 1024, 1024, 1024, 2816]
    - [81, 5196.98]
  - - [5888, 4288, 1, 3328, 5888, 5888, 5888, 3328]
    - [80, 3037.54]
  - - [5056, 448, 1, 256, 5056, 5056, 5056, 256]
    - [29, 1273.73]
  - - [1856, 5056, 1, 1280, 1856, 1856, 1856, 1280]
    - [50, 3436.6]
  - - [2944, 1024, 1, 1280, 2944, 2944, 2944, 1280]
    - [48, 2667.73]
  - - [2368, 4288, 1, 256, 2368, 2368, 2368, 256]
    - [43, 2419.45]
  - - [1024, 2368, 1, 3328, 1024, 1024, 1024, 3328]
    - [48, 3200.56]
  - - [4288, 5888, 1, 3328, 4288, 4288, 4288, 3328]
    - [13, 4372.93]
  - - [1024, 2944, 1, 3328, 1024, 1024, 1024, 3328]
    - [82, 2752.92]
  - - [256, 6784, 1, 1280, 256, 256, 256, 1280]
    - [16, 2402.64]
  - - [1856, 3584, 1, 256, 1856, 1856, 1856, 256]
    - [26, 2148.28]
  - - [1024, 1500, 1, 2048, 1024, 1024, 1024, 2048]
    - [19, 2246.28]
  - - [512, 24000, 1, 2816, 512, 512, 512, 2816]
    - [35, 4559.27]
  - - [256, 5888, 1, 1280, 256, 256, 256, 1280]
    - [55, 2090.22]
  - - [2944, 2368, 1, 256, 2944, 2944, 2944, 256]
    - [43, 1937.91]
  - - [1024, 1856, 1, 256, 1024, 1024, 1024, 256]
    - [0, 1873.36]
  - - [6784, 3584, 1, 3328, 6784, 6784, 6784, 3328]
    - [49, 4447.7]
  - - [1760, 7000, 1, 1760, 1760, 1760, 1760, 1760]
    - [27, 3633.61]
  - - [1024, 5888, 1, 3328, 1024, 1024, 1024, 3328]
    - [69, 3586.65]
  - - [1408, 2368, 1, 1280, 1408, 1408, 1408, 1280]
    - [25, 3053.08]
  - - [2944, 2944, 1, 256, 2944, 2944, 2944, 256]
    - [9, 2168.38]
  - - [6784, 256, 1, 256, 6784, 6784, 6784, 256]
    - [40, 1410.97]
  - - [1024, 3000, 1, 1536, 1024, 1024, 1024, 1536]
    - [2, 2814.85]
  - - [5888, 1408, 1, 256, 5888, 5888, 5888, 256]
    - [2, 2134.51]
  - - [5888, 6784, 1, 3328, 5888, 5888, 5888, 3328]
    - [54, 4712.01]
  - - [704, 4288, 1, 1280, 704, 704, 704, 1280]
    - [36, 2535.14]
  - - [128, 50176, 1, 512, 128, 128, 128, 512]
    - [22, 2253.85]
  - - [1024, 48000, 1, 2048, 1024, 1024, 1024, 2048]
    - [14, 4374.45]
  - - [784, 512, 64, 128, 784, 784, 784, 128]
    - [29, 2234.22]
  - - [3136, 256, 64, 64, 3136, 3136, 3136, 64]
    - [33, 1822.73]
  - - [12544, 1024, 1, 256, 12544, 12544, 12544, 256]
    - [71, 2564.74]
  - - [784, 128, 128, 512, 784, 784, 784, 512]
    - [63, 2336.54]
  - - [784, 512, 256, 128, 784, 784, 784, 128]
    - [6, 2899.0]
  - - [3136, 512, 1, 2048, 3136, 3136, 3136, 2048]
    - [35, 2281.92]
  - - [12544, 256, 1, 1024, 12544, 12544, 12544, 1024]
    - [28, 2703.44]
  - - [3136, 2048, 1, 512, 3136, 3136, 3136, 512]
    - [54, 2483.39]
  - - [3136, 256, 256, 64, 3136, 3136, 3136, 64]
    - [5, 2279.78]
  - - [784, 128, 64, 512, 784, 784, 784, 512]
    - [73, 1970.63]
  - - [784, 512, 128, 128, 784, 784, 784, 128]
    - [18, 2626.84]
  - - [784, 128, 256, 512, 784, 784, 784, 512]
    - [49, 2628.37]
  - - [3136, 256, 128, 64, 3136, 3136, 3136, 64]
    - [32, 1954.81]
  - - [1024, 1024, 1, 3328, 1024, 1024, 1024, 3328]
    - [84, 4075.14]
  - - [128, 6784, 1, 3328, 128, 128, 128, 3328]
    - [105, 2253.02]
  - - [256, 4288, 1, 3328, 256, 256, 256, 3328]
    - [96, 2799.52]
  - - [704, 1856, 1, 3328, 704, 704, 704, 3328]
    - [95, 2520.01]
  - - [448, 1024, 1, 1280, 448, 448, 448, 1280]
    - [85, 1114.32]
  - - [1024, 704, 1, 256, 1024, 1024, 1024, 256]
    - [93, 4752.26]
  - - [256, 1856, 1, 1280, 256, 256, 256, 1280]
    - [84, 2955.01]
  - - [256, 2944, 1, 3328, 256, 256, 256, 3328]
    - [95, 1987.31]
  - - [128, 3584, 1, 1280, 128, 128, 128, 1280]
    - [88, 1218.46]
  - - [4288, 256, 1, 256, 4288, 4288, 4288, 256]
    - [86, 1236.05]
  - - [5888, 64, 1, 3328, 5888, 5888, 5888, 3328]
    - [90, 1569.86]
  - - [2944, 256, 1, 3328, 2944, 2944, 2944, 3328]
    - [113, 2029.1]
  - - [1408, 448, 1, 1280, 1408, 1408, 1408, 1280]
    - [87, 1929.3]
  - - [1408, 256, 1, 1280, 1408, 1408, 1408, 1280]
    - [93, 1194.4]
  - - [3072, 128, 1, 1024, 3072, 3072, 3072, 1024]
    - [106, 1323.81]
  - - [6784, 64, 1, 256, 6784, 6784, 6784, 256]
    - [93, 3009.72]
  - - [2368, 128, 1, 3328, 2368, 2368, 2368, 3328]
    - [84, 2767.34]
  - - [2944, 128, 1, 256, 2944, 2944, 2944, 256]
    - [101, 3772.89]
  - - [448, 1408, 1, 256, 448, 448, 448, 256]
    - [87, 4134.75]
  - - [64, 5056, 1, 3328, 64, 64, 64, 3328]
    - [84, 2092.76]
  - - [512, 1500, 1, 2816, 512, 512, 512, 2816]
    - [94, 2101.14]
  - - [256, 3584, 1, 3328, 256, 256, 256, 3328]
    - [94, 2463.89]
  - - [256, 1408, 1, 256, 256, 256, 256, 256]
    - [96, 3628.79]
  - - [5056, 64, 1, 1280, 5056, 5056, 5056, 1280]
    - [84, 2085.56]
  - - [2368, 128, 1, 256, 2368, 2368, 2368, 256]
    - [93, 3020.54]
  - - [4288, 128, 1, 1280, 4288, 4288, 4288, 1280]
    - [84, 1951.16]
  - - [5888, 64, 1, 256, 5888, 5888, 5888, 256]
    - [104, 3266.09]
  - - [1856, 256, 1, 1280, 1856, 1856, 1856, 1280]
    - [84, 2668.91]
  - - [64, 5888, 1, 3328, 64, 64, 64, 3328]
    - [103, 1327.4]
  - - [1024, 704, 1, 1280, 1024, 1024, 1024, 1280]
    - [87, 1835.82]
  - - [256, 1408, 1, 3328, 256, 256, 256, 3328]
    - [104, 1546.21]
  - - [6784, 128, 1, 3328, 6784, 6784, 6784, 3328]
    - [87, 2052.66]
  - - [704, 704, 1, 3328, 704, 704, 704, 3328]
    - [86, 1564.18]
  - - [3584, 256, 1, 3328, 3584, 3584, 3584, 3328]
    - [117, 2102.3]
  - - [128, 3584, 1, 3328, 128, 128, 128, 3328]
    - [96, 1465.94]
  - - [128, 2944, 1, 1280, 128, 128, 128, 1280]
    - [102, 1264.93]
  - - [448, 1856, 1, 1280, 448, 448, 448, 1280]
    - [85, 1572.82]
  - - [3584, 128, 1, 256, 3584, 3584, 3584, 256]
    - [102, 3933.43]
  - - [448, 1408, 1, 3328, 448, 448, 448, 3328]
    - [84, 3297.96]
  - - [704, 1024, 1, 256, 704, 704, 704, 256]
    - [101, 4303.71]
  - - [256, 3584, 1, 256, 256, 256, 256, 256]
    - [93, 4945.85]
  - - [1408, 704, 1, 256, 1408, 1408, 1408, 256]
    - [85, 5089.87]
  - - [448, 2944, 1, 3328, 448, 448, 448, 3328]
    - [84, 2976.42]
  - - [64, 5888, 1, 256, 64, 64, 64, 256]
    - [98, 2645.2]
  - - [512, 1500, 1, 2048, 512, 512, 512, 2048]
    - [84, 2277.09]
  - - [448, 2368, 1, 1280, 448, 448, 448, 1280]
    - [111, 1638.43]
  - - [704, 704, 1, 256, 704, 704, 704, 256]
    - [104, 3802.89]
  - - [64, 193600, 1, 64, 64, 64, 64, 64]
    - [84, 2422.2]
  - - [128, 4288, 1, 3328, 128, 128, 128, 3328]
    - [101, 1718.79]
  - - [256, 2368, 1, 256, 256, 256, 256, 256]
    - [100, 4415.5]
  - - [1024, 448, 1, 3328, 1024, 1024, 1024, 3328]
    - [84, 3613.86]
  - - [1856, 704, 1, 1280, 1856, 1856, 1856, 1280]
    - [97, 1995.36]
  - - [1024, 1024, 1, 1280, 1024, 1024, 1024, 1280]
    - [114, 1583.55]
  - - [256, 2944, 1, 256, 256, 256, 256, 256]
    - [90, 4662.76]
  - - [1024, 700, 1, 512, 1024, 1024, 1024, 512]
    - [86, 5188.44]
  - - [128, 6784, 1, 1280, 128, 128, 128, 1280]
    - [84, 2695.67]
  - - [1408, 704, 1, 3328, 1408, 1408, 1408, 3328]
    - [102, 2118.8]
  - - [128, 5888, 1, 1280, 128, 128, 128, 1280]
    - [85, 1691.47]
  - - [704, 1408, 1, 3328, 704, 704, 704, 3328]
    - [101, 2450.59]
  - - [7680, 64, 1, 2560, 7680, 7680, 7680, 2560]
    - [104, 1726.84]
  - - [448, 704, 1, 1280, 448, 448, 448, 1280]
    - [84, 1078.69]
  - - [6784, 128, 1, 256, 6784, 6784, 6784, 256]
    - [101, 4580.4]
  - - [704, 448, 1, 256, 704, 704, 704, 256]
    - [87, 3426.28]
  - - [256, 1856, 1, 3328, 256, 256, 256, 3328]
    - [84, 2983.0]
  - - [1024, 704, 1, 3328, 1024, 1024, 1024, 3328]
    - [104, 1920.29]
  - - [128, 4288, 1, 256, 128, 128, 128, 256]
    - [90, 4136.94]
  - - [64, 6784, 1, 3328, 64, 64, 64, 3328]
    - [84, 2314.61]
  - - [2944, 256, 1, 1280, 2944, 2944, 2944, 1280]
    - [87, 1934.69]
  - - [1856, 704, 1, 256, 1856, 1856, 1856, 256]
    - [89, 1156.64]
  - - [704, 1856, 1, 256, 704, 704, 704, 256]
    - [104, 1180.38]
  - - [2944, 448, 1, 256, 2944, 2944, 2944, 256]
    - [86, 1312.4]
  - - [2368, 128, 1, 1280, 2368, 2368, 2368, 1280]
    - [87, 1108.27]
  - - [64, 6784, 1, 256, 64, 64, 64, 256]
    - [103, 2709.76]
  - - [64, 5056, 1, 1280, 64, 64, 64, 1280]
    - [84, 2110.47]
  - - [704, 448, 1, 3328, 704, 704, 704, 3328]
    - [99, 1267.52]
  - - [2368, 256, 1, 1280, 2368, 2368, 2368, 1280]
    - [87, 1264.36]
  - - [2368, 448, 1, 1280, 2368, 2368, 2368, 1280]
    - [101, 1392.11]
  - - [128, 3584, 1, 256, 128, 128, 128, 256]
    - [107, 3640.27]
  - - [1856, 448, 1, 3328, 1856, 1856, 1856, 3328]
    - [84, 3704.5]
  - - [128, 5056, 1, 256, 128, 128, 128, 256]
    - [100, 3942.77]
  - - [4288, 256, 1, 1280, 4288, 4288, 4288, 1280]
    - [84, 2095.92]
  - - [4288, 128, 1, 3328, 4288, 4288, 4288, 3328]
    - [116, 1728.08]
  - - [7680, 128, 1, 2560, 7680, 7680, 7680, 2560]
    - [113, 1960.56]
  - - [448, 2368, 1, 3328, 448, 448, 448, 3328]
    - [95, 2325.73]
  - - [256, 1408, 1, 1280, 256, 256, 256, 1280]
    - [86, 1163.93]
  - - [128, 2368, 1, 256, 128, 128, 128, 256]
    - [94, 3140.59]
  - - [6784, 64, 1, 3328, 6784, 6784, 6784, 3328]
    - [84, 2267.81]
  - - [128, 2944, 1, 3328, 128, 128, 128, 3328]
    - [115, 1364.52]
  - - [2944, 448, 1, 3328, 2944, 2944, 2944, 3328]
    - [101, 2481.96]
  - - [5888, 128, 1, 256, 5888, 5888, 5888, 256]
    - [107, 4343.05]
  - - [5056, 64, 1, 256, 5056, 5056, 5056, 256]
    - [99, 2588.63]
  - - [512, 1500, 1, 1536, 512, 512, 512, 1536]
    - [84, 2694.53]
  - - [128, 5056, 1, 3328, 128, 128, 128, 3328]
    - [96, 1981.1]
  - - [256, 4288, 1, 1280, 256, 256, 256, 1280]
    - [85, 1449.44]
  - - [4288, 128, 1, 256, 4288, 4288, 4288, 256]
    - [106, 3735.8]
  - - [3584, 256, 1, 256, 3584, 3584, 3584, 256]
    - [104, 4918.87]
  - - [128, 2944, 1, 256, 128, 128, 128, 256]
    - [86, 3672.21]
  - - [3584, 128, 1, 3328, 3584, 3584, 3584, 3328]
    - [84, 3002.13]
  - - [5888, 128, 1, 3328, 5888, 5888, 5888, 3328]
    - [111, 1979.44]
  - - [64, 193600, 1, 256, 64, 64, 64, 256]
    - [91, 1614.99]
  - - [1408, 704, 1, 1280, 1408, 1408, 1408, 1280]
    - [95, 1376.32]
  - - [448, 1408, 1, 1280, 448, 448, 448, 1280]
    - [94, 1129.77]
  - - [704, 1408, 1, 1280, 704, 704, 704, 1280]
    - [109, 1348.29]
  - - [448, 2944, 1, 256, 448, 448, 448, 256]
    - [93, 1071.54]
  - - [448, 2368, 1, 256, 448, 448, 448, 256]
    - [93, 1112.11]
  - - [64, 6784, 1, 1280, 64, 64, 64, 1280]
    - [98, 996.028]
  - - [128, 2368, 1, 3328, 128, 128, 128, 3328]
    - [90, 1149.03]
  - - [5056, 64, 1, 3328, 5056, 5056, 5056, 3328]
    - [99, 1138.16]
  - - [5056, 128, 1, 3328, 5056, 5056, 5056, 3328]
    - [113, 1708.0]
  - - [448, 704, 1, 256, 448, 448, 448, 256]
    - [87, 2900.89]
  - - [1856, 256, 1, 3328, 1856, 1856, 1856, 3328]
    - [84, 2957.51]
  - - [2944, 128, 1, 3328, 2944, 2944, 2944, 3328]
    - [94, 1340.69]
  - - [1024, 1024, 1, 256, 1024, 1024, 1024, 256]
    - [108, 3247.56]
  - - [704, 1024, 1, 1280, 704, 704, 704, 1280]
    - [102, 1236.0]
  - - [256, 4288, 1, 256, 256, 256, 256, 256]
    - [90, 1268.7]
  - - [2368, 256, 1, 256, 2368, 2368, 2368, 256]
    - [93, 4139.32]
  - - [256, 2368, 1, 3328, 256, 256, 256, 3328]
    - [84, 3364.0]
  - - [704, 448, 1, 1280, 704, 704, 704, 1280]
    - [87, 1175.4]
  - - [256, 1856, 1, 256, 256, 256, 256, 256]
    - [99, 3918.77]
  - - [64, 5056, 1, 256, 64, 64, 64, 256]
    - [92, 2586.97]
  - - [1408, 256, 1, 3328, 1408, 1408, 1408, 3328]
    - [84, 4144.88]
  - - [2368, 448, 1, 256, 2368, 2368, 2368, 256]
    - [94, 1194.43]
  - - [4288, 256, 1, 3328, 4288, 4288, 4288, 3328]
    - [106, 2146.54]
  - - [2944, 256, 1, 256, 2944, 2944, 2944, 256]
    - [106, 4678.59]
  - - [6784, 64, 1, 1280, 6784, 6784, 6784, 1280]
    - [84, 2268.29]
  - - [704, 1856, 1, 1280, 704, 704, 704, 1280]
    - [94, 1648.44]
  - - [448, 1024, 1, 3328, 448, 448, 448, 3328]
    - [110, 1514.0]
  - - [2944, 448, 1, 1280, 2944, 2944, 2944, 1280]
    - [89, 1676.9]
  - - [448, 1024, 1, 256, 448, 448, 448, 256]
    - [89, 3515.81]
  - - [1024, 448, 1, 1280, 1024, 1024, 1024, 1280]
    - [85, 5208.72]
  - - [256, 2368, 1, 1280, 256, 256, 256, 1280]
    - [85, 1815.11]
  - - [128, 5056, 1, 1280, 128, 128, 128, 1280]
    - [89, 1625.64]
  - - [1408, 256, 1, 256, 1408, 1408, 1408, 256]
    - [106, 3648.95]
  - - [128, 5888, 1, 3328, 128, 128, 128, 3328]
    - [84, 2511.76]
  - - [2368, 448, 1, 3328, 2368, 2368, 2368, 3328]
    - [96, 2236.22]
  - - [3584, 128, 1, 1280, 3584, 3584, 3584, 1280]
    - [106, 1269.96]
  - - [1408, 448, 1, 256, 1408, 1408, 1408, 256]
    - [93, 4591.82]
  - - [2368, 256, 1, 3328, 2368, 2368, 2368, 3328]
    - [84, 2369.13]
  - - [5888, 128, 1, 1280, 5888, 5888, 5888, 1280]
    - [102, 1319.33]
  - - [256, 3584, 1, 1280, 256, 256, 256, 1280]
    - [85, 1705.86]
  - - [128, 5888, 1, 256, 128, 128, 128, 256]
    - [96, 4418.8]
  - - [1024, 1024, 1, 1024, 1024, 1024, 1024, 1024]
    - [84, 3197.57]
  - - [1408, 448, 1, 3328, 1408, 1408, 1408, 3328]
    - [99, 1923.07]
  - - [64, 5888, 1, 1280, 64, 64, 64, 1280]
    - [98, 1007.73]
  - - [704, 704, 1, 1280, 704, 704, 704, 1280]
    - [85, 1201.52]
  - - [128, 2368, 1, 1280, 128, 128, 128, 1280]
    - [85, 1139.93]
  - - [3584, 256, 1, 1280, 3584, 3584, 3584, 1280]
    - [104, 1879.37]
  - - [5888, 64, 1, 1280, 5888, 5888, 5888, 1280]
    - [105, 1186.07]
  - - [5056, 128, 1, 1280, 5056, 5056, 5056, 1280]
    - [89, 1768.4]
  - - [448, 1856, 1, 3328, 448, 448, 448, 3328]
    - [96, 2033.12]
  - - [1024, 448, 1, 256, 1024, 1024, 1024, 256]
    - [93, 3928.24]
  - - [2944, 128, 1, 1280, 2944, 2944, 2944, 1280]
    - [85, 4332.49]
  - - [256, 2944, 1, 1280, 256, 256, 256, 1280]
    - [87, 1818.01]
  - - [2560, 128, 1, 2560, 2560, 2560, 2560, 2560]
    - [85, 1323.91]
  - - [704, 1024, 1, 3328, 704, 704, 704, 3328]
    - [87, 1863.57]
  - - [1856, 448, 1, 1280, 1856, 1856, 1856, 1280]
    - [89, 1731.82]
  - - [128, 6784, 1, 256, 128, 128, 128, 256]
    - [105, 4428.65]
  - - [704, 1408, 1, 256, 704, 704, 704, 256]
    - [88, 4844.56]
  - - [4096, 128, 1, 4096, 4096, 4096, 4096, 4096]
    - [84, 2164.22]
  - - [448, 2944, 1, 1280, 448, 448, 448, 1280]
    - [111, 1624.32]
  - - [1856, 256, 1, 256, 1856, 1856, 1856, 256]
    - [96, 3676.66]
  - - [5056, 128, 1, 256, 5056, 5056, 5056, 256]
    - [99, 3911.07]
  - - [6784, 128, 1, 1280, 6784, 6784, 6784, 1280]
    - [84, 2087.18]
  - - [1856, 448, 1, 256, 1856, 1856, 1856, 256]
    - [96, 4267.93]
  - - [128, 4288, 1, 1280, 128, 128, 128, 1280]
    - [84, 2135.62]
  - - [448, 704, 1, 3328, 448, 448, 448, 3328]
    - [96, 1145.59]
  - - [448, 1856, 1, 256, 448, 448, 448, 256]
    - [99, 4227.12]
  - - [1856, 704, 1, 3328, 1856, 1856, 1856, 3328]
    - [89, 2335.69]
  - - [512, 1500, 1, 2560, 512, 512, 512, 2560]
    - [104, 1774.14]
  - - [3136, 64, 128, 64, 3136, 3136, 3136, 64]
    - [100, 1024.29]
  - - [3136, 64, 64, 256, 3136, 3136, 3136, 256]
    - [87, 1719.96]
  - - [3136, 64, 128, 256, 3136, 3136, 3136, 256]
    - [108, 1862.73]
  - - [3136, 64, 256, 64, 3136, 3136, 3136, 64]
    - [112, 1258.18]
  - - [3136, 64, 64, 64, 3136, 3136, 3136, 64]
    - [85, 1229.46]
  - - [3136, 64, 256, 256, 3136, 3136, 3136, 256]
    - [109, 2448.06]
  - - [2368, 64, 1, 3328, 2368, 2368, 2368, 3328]
    - [161, 810.545]
  - - [256, 704, 1, 1280, 256, 256, 256, 1280]
    - [140, 757.644]
  - - [1408, 64, 1, 1280, 1408, 1408, 1408, 1280]
    - [138, 2858.11]
  - - [4096, 32, 1, 4096, 4096, 4096, 4096, 4096]
    - [118, 967.307]
  - - [3072, 64, 1, 1024, 3072, 3072, 3072, 1024]
    - [160, 772.266]
  - - [1024, 256, 1, 3328, 1024, 1024, 1024, 3328]
    - [159, 948.845]
  - - [6144, 32, 1, 2560, 6144, 6144, 6144, 2560]
    - [146, 795.93]
  - - [704, 128, 1, 1280, 704, 704, 704, 1280]
    - [169, 2873.78]
  - - [64, 3584, 1, 3328, 64, 64, 64, 3328]
    - [118, 1058.56]
  - - [1024, 256, 1, 256, 1024, 1024, 1024, 256]
    - [135, 2932.63]
  - - [448, 448, 1, 256, 448, 448, 448, 256]
    - [145, 2595.29]
  - - [7680, 32, 1, 2560, 7680, 7680, 7680, 2560]
    - [118, 992.115]
  - - [128, 1024, 1, 3328, 128, 128, 128, 3328]
    - [158, 749.643]
  - - [64, 1856, 1, 1280, 64, 64, 64, 1280]
    - [165, 2920.6]
  - - [448, 256, 1, 256, 448, 448, 448, 256]
    - [145, 2009.94]
  - - [256, 1024, 1, 256, 256, 256, 256, 256]
    - [135, 2807.26]
  - - [1024, 128, 1, 1280, 1024, 1024, 1024, 1280]
    - [118, 1298.28]
  - - [3072, 32, 1, 1024, 3072, 3072, 3072, 1024]
    - [140, 2351.86]
  - - [448, 256, 1, 3328, 448, 448, 448, 3328]
    - [118, 1261.19]
  - - [128, 704, 1, 1280, 128, 128, 128, 1280]
    - [135, 2722.9]
  - - [1856, 128, 1, 3328, 1856, 1856, 1856, 3328]
    - [147, 1119.48]
  - - [256, 448, 1, 256, 256, 256, 256, 256]
    - [137, 1972.07]
  - - [8448, 32, 1, 2816, 8448, 8448, 8448, 2816]
    - [118, 846.103]
  - - [448, 448, 1, 3328, 448, 448, 448, 3328]
    - [139, 781.727]
  - - [1408, 128, 1, 1280, 1408, 1408, 1408, 1280]
    - [148, 714.567]
  - - [128, 1856, 1, 1280, 128, 128, 128, 1280]
    - [141, 765.383]
  - - [2048, 128, 1, 2048, 2048, 2048, 2048, 2048]
    - [143, 788.455]
  - - [64, 1408, 1, 3328, 64, 64, 64, 3328]
    - [144, 644.924]
  - - [256, 704, 1, 256, 256, 256, 256, 256]
    - [123, 2368.81]
  - - [128, 1408, 1, 256, 128, 128, 128, 256]
    - [141, 2431.29]
  - - [256, 448, 1, 3328, 256, 256, 256, 3328]
    - [118, 1395.64]
  - - [64, 2368, 1, 1280, 64, 64, 64, 1280]
    - [146, 711.777]
  - - [2368, 64, 1, 256, 2368, 2368, 2368, 256]
    - [145, 2197.65]
  - - [704, 128, 1, 3328, 704, 704, 704, 3328]
    - [118, 1420.34]
  - - [4288, 64, 1, 1280, 4288, 4288, 4288, 1280]
    - [140, 755.411]
  - - [2560, 64, 1, 2560, 2560, 2560, 2560, 2560]
    - [136, 750.023]
  - - [128, 1024, 1, 1280, 128, 128, 128, 1280]
    - [168, 724.716]
  - - [128, 1024, 1, 256, 128, 128, 128, 256]
    - [136, 2130.44]
  - - [1856, 64, 1, 256, 1856, 1856, 1856, 256]
    - [143, 2113.62]
  - - [704, 128, 1, 256, 704, 704, 704, 256]
    - [137, 1872.0]
  - - [448, 256, 1, 1280, 448, 448, 448, 1280]
    - [146, 2482.57]
  - - [1856, 128, 1, 1280, 1856, 1856, 1856, 1280]
    - [165, 747.337]
  - - [64, 3584, 1, 256, 64, 64, 64, 256]
    - [141, 2427.86]
  - - [64, 1856, 1, 256, 64, 64, 64, 256]
    - [160, 1923.32]
  - - [256, 1024, 1, 1280, 256, 256, 256, 1280]
    - [118, 1472.5]
  - - [3584, 64, 1, 1280, 3584, 3584, 3584, 1280]
    - [145, 740.596]
  - - [1408, 128, 1, 3328, 1408, 1408, 1408, 3328]
    - [145, 990.19]
  - - [64, 2944, 1, 3328, 64, 64, 64, 3328]
    - [159, 771.661]
  - - [64, 4288, 1, 3328, 64, 64, 64, 3328]
    - [168, 904.863]
  - - [128, 1500, 1, 1280, 128, 128, 128, 1280]
    - [145, 718.532]
  - - [64, 2944, 1, 256, 64, 64, 64, 256]
    - [138, 2399.96]
  - - [64, 1408, 1, 1280, 64, 64, 64, 1280]
    - [165, 2639.22]
  - - [64, 2944, 1, 1280, 64, 64, 64, 1280]
    - [118, 948.887]
  - - [704, 256, 1, 256, 704, 704, 704, 256]
    - [124, 2489.2]
  - - [256, 448, 1, 1280, 256, 256, 256, 1280]
    - [118, 1244.87]
  - - [704, 256, 1, 1280, 704, 704, 704, 1280]
    - [163, 711.256]
  - - [64, 2368, 1, 3328, 64, 64, 64, 3328]
    - [140, 728.406]
  - - [256, 704, 1, 3328, 256, 256, 256, 3328]
    - [140, 769.347]
  - - [4096, 64, 1, 4096, 4096, 4096, 4096, 4096]
    - [167, 1055.27]
  - - [1760, 128, 1, 1760, 1760, 1760, 1760, 1760]
    - [163, 730.287]
  - - [2944, 64, 1, 1280, 2944, 2944, 2944, 1280]
    - [148, 746.341]
  - - [128, 1408, 1, 3328, 128, 128, 128, 3328]
    - [166, 798.364]
  - - [1408, 64, 1, 256, 1408, 1408, 1408, 256]
    - [147, 1824.48]
  - - [64, 2368, 1, 256, 64, 64, 64, 256]
    - [136, 2095.45]
  - - [1024, 128, 1, 3328, 1024, 1024, 1024, 3328]
    - [118, 1339.95]
  - - [2368, 64, 1, 1280, 2368, 2368, 2368, 1280]
    - [162, 674.486]
  - - [4288, 64, 1, 256, 4288, 4288, 4288, 256]
    - [138, 2656.08]
  - - [64, 4288, 1, 1280, 64, 64, 64, 1280]
    - [118, 955.638]
  - - [1408, 64, 1, 3328, 1408, 1408, 1408, 3328]
    - [142, 677.721]
  - - [2944, 64, 1, 256, 2944, 2944, 2944, 256]
    - [140, 2446.28]
  - - [448, 448, 1, 1280, 448, 448, 448, 1280]
    - [118, 1637.37]
  - - [1024, 256, 1, 1280, 1024, 1024, 1024, 1280]
    - [142, 762.226]
  - - [3584, 64, 1, 3328, 3584, 3584, 3584, 3328]
    - [146, 861.33]
  - - [256, 1024, 1, 3328, 256, 256, 256, 3328]
    - [137, 962.358]
  - - [1856, 64, 1, 3328, 1856, 1856, 1856, 3328]
    - [160, 751.975]
  - - [1856, 64, 1, 1280, 1856, 1856, 1856, 1280]
    - [169, 2908.28]
  - - [4608, 32, 1, 1536, 4608, 4608, 4608, 1536]
    - [118, 999.3]
  - - [1024, 128, 1, 256, 1024, 1024, 1024, 256]
    - [135, 2375.28]
  - - [64, 3584, 1, 1280, 64, 64, 64, 1280]
    - [118, 935.522]
  - - [3584, 64, 1, 256, 3584, 3584, 3584, 256]
    - [148, 2628.19]
  - - [64, 1856, 1, 3328, 64, 64, 64, 3328]
    - [118, 850.201]
  - - [1408, 128, 1, 256, 1408, 1408, 1408, 256]
    - [136, 2569.75]
  - - [128, 704, 1, 256, 128, 128, 128, 256]
    - [148, 1856.78]
  - - [128, 704, 1, 3328, 128, 128, 128, 3328]
    - [118, 1320.69]
  - - [128, 1856, 1, 256, 128, 128, 128, 256]
    - [148, 2623.25]
  - - [64, 4288, 1, 256, 64, 64, 64, 256]
    - [141, 2668.23]
  - - [2560, 32, 1, 2560, 2560, 2560, 2560, 2560]
    - [118, 1054.81]
  - - [704, 256, 1, 3328, 704, 704, 704, 3328]
    - [164, 949.167]
  - - [176, 1500, 1, 1408, 176, 176, 176, 1408]
    - [126, 764.864]
  - - [1856, 128, 1, 256, 1856, 1856, 1856, 256]
    - [137, 2818.1]
  - - [4288, 64, 1, 3328, 4288, 4288, 4288, 3328]
    - [137, 968.753]
  - - [2048, 64, 1, 2048, 2048, 2048, 2048, 2048]
    - [162, 730.279]
  - - [64, 1408, 1, 256, 64, 64, 64, 256]
    - [148, 1760.3]
  - - [2944, 64, 1, 3328, 2944, 2944, 2944, 3328]
    - [118, 1059.91]
  - - [128, 1408, 1, 1280, 128, 128, 128, 1280]
    - [144, 773.955]
  - - [128, 1856, 1, 3328, 128, 128, 128, 3328]
    - [125, 969.247]
  - - [1760, 64, 1, 1760, 1760, 1760, 1760, 1760]
    - [139, 732.361]
  - - [1760, 32, 1, 1760, 1760, 1760, 1760, 1760]
    - [170, 805.922]
  - - [2560, 16, 1, 2560, 2560, 2560, 2560, 2560]
    - [174, 485.292]
  - - [1760, 16, 1, 1760, 1760, 1760, 1760, 1760]
    - [178, 1163.94]
  - - [8448, 4, 1, 2816, 8448, 8448, 8448, 2816]
    - [170, 319.94]
  - - [7680, 16, 1, 2560, 7680, 7680, 7680, 2560]
    - [171, 655.342]
  - - [4608, 1, 1, 1536, 4608, 4608, 4608, 1536]
    - [183, 81.3312]
  - - [7680, 4, 1, 2560, 7680, 7680, 7680, 2560]
    - [170, 187.479]
  - - [8448, 16, 1, 2816, 8448, 8448, 8448, 2816]
    - [184, 564.199]
  - - [3072, 2, 1, 1024, 3072, 3072, 3072, 1024]
    - [177, 168.351]
  - - [6144, 16, 1, 2560, 6144, 6144, 6144, 2560]
    - [170, 681.331]
  - - [7680, 1, 1, 2560, 7680, 7680, 7680, 2560]
    - [172, 45.7849]
  - - [4608, 4, 1, 1536, 4608, 4608, 4608, 1536]
    - [175, 342.684]
  - - [3072, 1, 1, 128, 3072, 3072, 3072, 128]
    - [178, 47.0579]
  - - [2048, 32, 1, 2048, 2048, 2048, 2048, 2048]
    - [174, 1977.6]
  - - [2048, 16, 1, 2048, 2048, 2048, 2048, 2048]
    - [185, 1272.44]
  - - [8448, 1, 1, 2816, 8448, 8448, 8448, 2816]
    - [170, 80.4619]
  - - [6144, 4, 1, 2560, 6144, 6144, 6144, 2560]
    - [182, 179.707]
  - - [3072, 1, 1, 1024, 3072, 3072, 3072, 1024]
    - [176, 84.583]
  - - [3072, 16, 1, 1024, 3072, 3072, 3072, 1024]
    - [180, 1296.76]
  - - [4096, 16, 1, 4096, 4096, 4096, 4096, 4096]
    - [170, 726.556]
  - - [6144, 1, 1, 2560, 6144, 6144, 6144, 2560]
    - [183, 45.6265]
  - - [3072, 4, 1, 1024, 3072, 3072, 3072, 1024]
    - [178, 334.372]
  - - [7680, 2, 1, 2560, 7680, 7680, 7680, 2560]
    - [170, 156.213]
  - - [4224, 1, 1, 128, 4224, 4224, 4224, 128]
    - [173, 55.1791]
  - - [8448, 2, 1, 2816, 8448, 8448, 8448, 2816]
    - [170, 158.528]
  - - [4608, 2, 1, 1536, 4608, 4608, 4608, 1536]
    - [181, 171.591]
  - - [4608, 16, 1, 1536, 4608, 4608, 4608, 1536]
    - [170, 727.918]
  - - [6144, 2, 1, 2560, 6144, 6144, 6144, 2560]
    - [179, 88.5382]
  - - [1024, 1, 1, 500000, 1024, 1024, 1024, 500000]
    - [156, 55.6468]
  - - [1024, 16, 1, 500000, 1024, 1024, 1024, 500000]
    - [149, 805.308]
  - - [1024, 2, 1, 500000, 1024, 1024, 1024, 500000]
    - [153, 114.6]
  - - [512, 1, 1, 500000, 512, 512, 512, 500000]
    - [150, 38.7054]
  - - [1024, 8, 1, 500000, 1024, 1024, 1024, 500000]
    - [129, 416.98]
  - - [1024, 4, 1, 500000, 1024, 1024, 1024, 500000]
    - [156, 208.677]
  - - [512, 16, 1, 500000, 512, 512, 512, 500000]
    - [154, 561.311]
  - - [512, 2, 1, 500000, 512, 512, 512, 500000]
    - [153, 82.3915]
  - - [512, 8, 1, 500000, 512, 512, 512, 500000]
    - [150, 296.469]
  - - [512, 4, 1, 500000, 512, 512, 512, 500000]
    - [154, 146.407]
  - - [512, 4, 1, 512, 512, 512, 512, 512]
    - [150, 111.102]
  - - [448, 64, 1, 1280, 448, 448, 448, 1280]
    - [167, 1744.3]
  - - [64, 1024, 1, 1280, 64, 64, 64, 1280]
    - [165, 2546.44]
  - - [64, 704, 1, 1280, 64, 64, 64, 1280]
    - [163, 2306.13]
  - - [256, 128, 1, 256, 256, 256, 256, 256]
    - [127, 1038.77]
  - - [64, 1024, 1, 3328, 64, 64, 64, 3328]
    - [118, 770.089]
  - - [128, 1, 1, 1408, 128, 128, 128, 1408]
    - [152, 12.1872]
  - - [1024, 64, 1, 1280, 1024, 1024, 1024, 1280]
    - [144, 2729.07]
  - - [256, 256, 1, 3328, 256, 256, 256, 3328]
    - [118, 1235.32]
  - - [64, 448, 1, 1280, 64, 64, 64, 1280]
    - [163, 1688.02]
  - - [512, 32, 1, 512, 512, 512, 512, 512]
    - [152, 864.939]
  - - [64, 64, 1, 3328, 64, 64, 64, 3328]
    - [157, 485.564]
  - - [512, 1, 1, 512, 512, 512, 512, 512]
    - [154, 28.0143]
  - - [512, 2, 1, 512, 512, 512, 512, 512]
    - [151, 55.6687]
  - - [704, 64, 1, 3328, 704, 704, 704, 3328]
    - [118, 1271.11]
  - - [64, 128, 1, 256, 64, 64, 64, 256]
    - [122, 303.364]
  - - [704, 64, 1, 1280, 704, 704, 704, 1280]
    - [167, 2408.46]
  - - [128, 448, 1, 256, 128, 128, 128, 256]
    - [146, 1489.0]
  - - [448, 64, 1, 3328, 448, 448, 448, 3328]
    - [162, 2019.48]
  - - [64, 128, 1, 3328, 64, 64, 64, 3328]
    - [150, 914.972]
  - - [128, 128, 1, 3328, 128, 128, 128, 3328]
    - [156, 1479.67]
  - - [64, 1, 1, 1216, 64, 64, 64, 1216]
    - [155, 5.76218]
  - - [256, 256, 1, 256, 256, 256, 256, 256]
    - [137, 1664.57]
  - - [128, 64, 1, 1280, 128, 128, 128, 1280]
    - [153, 729.825]
  - - [64, 1024, 1, 256, 64, 64, 64, 256]
    - [138, 1505.83]
  - - [64, 704, 1, 256, 64, 64, 64, 256]
    - [141, 1219.53]
  - - [1024, 2, 1, 512, 1024, 1024, 1024, 512]
    - [128, 89.6027]
  - - [256, 64, 1, 3328, 256, 256, 256, 3328]
    - [153, 1479.67]
  - - [448, 128, 1, 256, 448, 448, 448, 256]
    - [145, 1489.0]
  - - [64, 704, 1, 3328, 64, 64, 64, 3328]
    - [119, 1458.97]
  - - [64, 448, 1, 3328, 64, 64, 64, 3328]
    - [168, 1952.42]
  - - [448, 128, 1, 3328, 448, 448, 448, 3328]
    - [118, 1101.54]
  - - [128, 256, 1, 1280, 128, 128, 128, 1280]
    - [162, 1947.13]
  - - [64, 448, 1, 256, 64, 64, 64, 256]
    - [134, 857.881]
  - - [64, 256, 1, 1280, 64, 64, 64, 1280]
    - [150, 1238.54]
  - - [64, 128, 1, 1280, 64, 64, 64, 1280]
    - [155, 745.416]
  - - [1024, 32, 1, 512, 1024, 1024, 1024, 512]
    - [146, 1255.31]
  - - [64, 64, 1, 256, 64, 64, 64, 256]
    - [134, 175.611]
  - - [256, 128, 1, 1280, 256, 256, 256, 1280]
    - [167, 1963.58]
  - - [128, 256, 1, 3328, 128, 128, 128, 3328]
    - [162, 2288.58]
  - - [256, 64, 1, 256, 256, 256, 256, 256]
    - [133, 610.258]
  - - [128, 128, 1, 1280, 128, 128, 128, 1280]
    - [132, 1168.07]
  - - [128, 256, 1, 256, 128, 128, 128, 256]
    - [146, 944.982]
  - - [256, 64, 1, 1280, 256, 256, 256, 1280]
    - [150, 1254.92]
  - - [704, 64, 1, 256, 704, 704, 704, 256]
    - [148, 1279.11]
  - - [128, 448, 1, 1280, 128, 128, 128, 1280]
    - [136, 2596.04]
  - - [64, 64, 1, 1280, 64, 64, 64, 1280]
    - [152, 384.77]
  - - [128, 64, 1, 3328, 128, 128, 128, 3328]
    - [150, 921.155]
  - - [448, 64, 1, 256, 448, 448, 448, 256]
    - [148, 865.927]
  - - [1024, 16, 1, 512, 1024, 1024, 1024, 512]
    - [151, 725.533]
  - - [512, 16, 1, 512, 512, 512, 512, 512]
    - [131, 408.821]
  - - [1024, 64, 1, 256, 1024, 1024, 1024, 256]
    - [146, 1632.1]
  - - [128, 1, 1, 1024, 128, 128, 128, 1024]
    - [152, 10.6532]
  - - [448, 128, 1, 1280, 448, 448, 448, 1280]
    - [135, 2656.26]
  - - [1024, 64, 1, 3328, 1024, 1024, 1024, 3328]
    - [118, 827.715]
  - - [128, 64, 1, 256, 128, 128, 128, 256]
    - [121, 291.534]
  - - [64, 256, 1, 3328, 64, 64, 64, 3328]
    - [156, 1464.55]
  - - [256, 256, 1, 1280, 256, 256, 256, 1280]
    - [147, 2657.99]
  - - [256, 128, 1, 3328, 256, 256, 256, 3328]
    - [145, 2061.45]
  - - [64, 256, 1, 256, 64, 64, 64, 256]
    - [120, 528.583]
  - - [1024, 4, 1, 512, 1024, 1024, 1024, 512]
    - [151, 182.655]
  - - [128, 448, 1, 3328, 128, 128, 128, 3328]
    - [118, 1001.36]
  - - [1024, 1, 1, 512, 1024, 1024, 1024, 512]
    - [151, 44.957]
  - - [128, 128, 1, 256, 128, 128, 128, 256]
    - [130, 628.548]
- null
- null
- DeviceEfficiency
